"1001","","Millionaire Women Next Door: The Many Journeys of Successful American Businesswomen","Thomas J. Stanley","Economics","Finance","Nonfiction","3.87","709","2022/03/19"
"1002","","Retire Dollar $Mart","Jim Miller","","","","0.0","0","2022/03/19"
"1003","","The Millionaire Next Door: The Surprising Secrets of America's Wealthy","Thomas J. Stanley","Economics","Finance","Nonfiction","4.05","92305","2022/03/19"
"1004","","Think and Grow Rich","Napoleon Hill","Nonfiction","Self Help","Personal Development","4.18","269710","2022/03/19"
"1005","","Think and Grow Rich: The Landmark Bestseller Now Revised and Updated for the 21st Century","Napoleon Hill","Nonfiction","Self Help","Personal Development","4.18","269710","2022/03/19"
"1006","","Think and Grow Rich!","Napoleon Hill","Nonfiction","Self Help","Personal Development","4.18","269710","2022/03/19"
"1007","","Think and Grow Rich","Napoleon Hill","Nonfiction","Self Help","Personal Development","4.18","269710","2022/03/19"
"1008","","Think and Grow Rich","Napoleon Hill","Nonfiction","Self Help","Personal Development","4.18","269710","2022/03/19"
"1009","","The Think and Grow Rich Action Pack","Napoleon Hill","Nonfiction","Self Help","Personal Development","4.18","269710","2022/03/19"
"1010","","Think and Grow Rich","Napoleon Hill","Nonfiction","Self Help","Personal Development","4.18","269710","2022/03/19"
"1011","","Think and Grow Rich","Napoleon Hill","Nonfiction","Self Help","Personal Development","4.18","269710","2022/03/19"
"1012","","Think and Grow Rich","Napoleon Hill","Nonfiction","Self Help","Personal Development","4.18","269710","2022/03/19"
"1013","","Think and Grow Rich: Instant Motivator","Napoleon Hill","Nonfiction","Self Help","Personal Development","4.18","269710","2022/03/19"
"1014","","Pragmatic Version Control: Using Subversion (The Pragmatic Starter Kit Series)","Mike  Mason","Computer Science","Programming","Reference","3.59","227","2022/03/19"
"1015","","Version Control with Subversion","Ben Collins-Sussman","Computer Science","Programming","Computer Science","3.6","147","2022/03/19"
"1016","","Practical Subversion","Garrett Rooney","Computer Science","Technical","","3.83","6","2022/03/19"
"1017","","Control and Subversion: Gender Relations  in Tajikistan","Colette Harris","","","","4.29","7","2022/03/19"
"1018","","Bodies of Subversion: A Secret History of Women and Tattoo","Margot Mifflin","Nonfiction","History","Art","4.02","511","2022/03/19"
"1019","","Politics of Subversion","Antonio Negri","Philosophy","Politics","Nonfiction","3.31","29","2022/03/19"
"1020","","Dreams of Subversion in Medieval Jewish Art and Literature","Marc Michael Epstein","Literature","Jewish","","3.67","9","2022/03/19"
"1021","","Recovering Subversion: FEMINIST POLITICS BEYOND THE LAW","Nivedita Menon","Feminism","Cultural","India","4.32","22","2022/03/19"
"1022","","Read My Lips: Sexual Subversion and the End of Gender","Riki Anne Wilchins","LGBT","Queer","Gender","3.98","271","2022/03/19"
"1023","","101 Ways to Massively Increase the Value of Your Real Estate without Spending Much Money","Dolf de Roos","","","","3.96","46","2022/03/19"
"1024","","Real Estate Riches: How to Become Rich Using Your Banker's Money","Dolf de Roos","Business","Economics","Finance","4.09","4610","2022/03/19"
"1025","","The Insider's Guide to 52 Homes in 52 Weeks: Acquire Your Real Estate Fortune Today","Dolf de Roos","","","","3.96","56","2022/03/19"
"1026","","Real Estate Riches (Rich Dad's Advisors (Audio)) [ABRIDGED] (Rich Dad's Advisors (Audio))","Dolf de Roos","Business","Economics","Finance","4.09","4610","2022/03/19"
"1027","","The Insider's Guide to Tax-Free Real Estate Investments: Retire Rich Using Your IRA","Diane Kennedy","","","","3.0","7","2022/03/19"
"1028","","Extraordinary Profits From Ordinary Properties","Dolf de Roos","Business","","","2.0","2","2022/03/19"
"1029","","The New Zealand Investor's Guide To Making Money In Residential Real Estate","Jan Somers","Business","","","4.0","4","2022/03/19"
"1030","","Real Estate Riches: How to Become Rich Using Your Banker's Money","Dolf de Roos","Business","Economics","Finance","4.09","4610","2022/03/19"
"1031","","Trump: Think Like a Billionaire: Everything You Need to Know About Success, Real Estate, and Life","Donald J. Trump","Business","Nonfiction","Economics","3.62","1989","2022/03/19"
"1032","","Trump: The Art of the Deal","Donald J. Trump","Business","Biography","Nonfiction","3.66","18917","2022/03/19"
"1033","","Trump Strategies for Real Estate: Billionaire Lessons for the Small Investor","George H. Ross","Business","Economics","Finance","4.11","708","2022/03/19"
"1034","","Trump University Real Estate 101: Building Wealth with Real Estate Investments","Gary W. Eldred","Business","","","3.6","201","2022/03/19"
"1035","","Trump: How to Get Rich","Donald J. Trump","Business","Nonfiction","Self Help","3.35","2579","2022/03/19"
"1036","","Trump: The Way to the Top: The Best Business Advice I Ever Received","Donald J. Trump","Business","Nonfiction","Self Help","3.38","370","2022/03/19"
"1037","","Trump","Donald J. Trump","Business","Biography","Nonfiction","3.59","457","2022/03/19"
"1038","","Trump: Surviving at the Top","Donald J. Trump","Business","Biography","Self Help","3.51","192","2022/03/19"
"1039","","How to Build a Fortune [With CD-ROM with Workbook and Trump Cards and DVD]","Donald J. Trump","","","","2.92","38","2022/03/19"
"1040","","Real Estate Goldmine: How to get Rich Investing in Pre-Foreclosures (Audio Business Course)","Donald J. Trump","","","","2.81","32","2022/03/19"
"1041","","Trump: The Best Real Estate Advice I Ever Received: 100 Top Experts Share Their Strategies","Donald J. Trump","Business","Nonfiction","Economics","3.56","224","2022/03/19"
"1042","","Three Master Secrets of Real Estate Success [With CD-ROM with Workbook and Trump Cards]","Curtis Oakes","","","","3.35","26","2022/03/19"
"1043","","I Ain't Scared of You: Bernie Mac on How Life Is","Bernie Mac","Nonfiction","Humor","Biography","4.06","172","2022/03/19"
"1044","","Maybe You Never Cry Again","Bernie Mac","Autobiography","Memoir","Humor","4.29","513","2022/03/19"
"1045","","Bernie Mac","Joanne Mattern","","","","5.0","2","2022/03/19"
"1046","","Love Medicine and Miracles CD-ROM for Windows & Mac","Bernie S. Siegel","Health","Nonfiction","Self Help","4.26","4133","2022/03/19"
"1047","","The Beginner's Guide to Real Estate Investing","Gary W. Eldred","Business","Economics","Finance","3.73","84","2022/03/19"
"1048","","The Art of Deals and Dreams: The Complete Beginner's Guide to Intelligent Real Estate Investing.","Carlos Redmond","","","","5.0","1","2022/03/19"
"1049","","Jump Start: A Beginner's Guide to Basic Real Estate Investing","Hasani K Bakari","","","","0.0","0","2022/03/19"
"1050","","Riches in Real Estate: A Beginner's Guide to Group Investing","Robert Irwin","","","","0.0","0","2022/03/19"
"1051","","Investing Without Losing: The Beginner's Guide to Real Estate Tax Lien and Tax Deed Auctions","Don Sausa","","","","4.0","2","2022/03/19"
"1052","","The Richest Man in Babylon","George S. Clason","Economics","Finance","Business","4.26","149395","2022/03/19"
"1053","","The Richest Man in Babylon","George S. Clason","Economics","Finance","Business","4.26","149395","2022/03/19"
"1054","","Richest Man In Babylon For Today","Fred Siegel","Nonfiction","","","3.9","70","2022/03/19"
"1055","","The Richest Man in Babylon: 2the Success Secrets of the Ancients","George S. Clason","Economics","Finance","Business","4.26","149395","2022/03/19"
"1056","","The Richest Man in Babylon: The Success Secrets of the Ancients","George S. Clason","Economics","Finance","Business","4.26","149395","2022/03/19"
"1057","","The Richest Man in Babylon","Robert B. Goodman","Economics","Finance","","4.17","120","2022/03/19"
"1058","","The Richest Man In Babylon","George S. Clason","Economics","Finance","Business","4.26","149395","2022/03/19"
"1059","Nicholai Hel","Shibumi","Trevanian","Fiction","Thriller","Mystery","4.21","15415","2022/03/19"
"1060","","Shibumi and the Kitemaker","Mercer Mayer","Childrens","Picture Books","Cultural","4.06","88","2022/03/19"
"1061","","Trevanian: Four Complete Novels: The Eiger Sanction / The Loo Sanction / The Main / Shibumi","Trevanian","Thriller","Fiction","Spy Thriller","4.36","132","2022/03/19"
"1062","Nicholai Hel","Shibumi","Trevanian","Fiction","Thriller","Mystery","4.21","15415","2022/03/19"
"1063","Nicholai Hel","Shibumi","Trevanian","Fiction","Thriller","Mystery","4.21","15415","2022/03/19"
"1064","Nicholai Hel","Shibumi","Trevanian","Fiction","Thriller","Mystery","4.21","15415","2022/03/19"
"1065","Nicholai Hel","Shibumi","Trevanian","Fiction","Thriller","Mystery","4.21","15415","2022/03/19"
"1066","Nicholai Hel","Shibumi","Trevanian","Fiction","Thriller","Mystery","4.21","15415","2022/03/19"
"1067","","1776","David McCullough","History","Nonfiction","North American Hi...","4.07","210427","2022/03/19"
"1068","","1776","Peter Stone","Plays","History","Plays","4.21","1341","2022/03/19"
"1069","A History of Britain","The Fate of Empire, 1776-2000","Simon Schama","History","Nonfiction","European Literature","4.06","1086","2022/03/19"
"1070","","The Highland Scots of North Carolina, 1732-1776","Duane Meyer","History","Nonfiction","North American Hi...","3.82","71","2022/03/19"
"1071","","The 1776 Quilt: Heartache, Heritage, and Happiness","Pam Holland","","","","4.4","10","2022/03/19"
"1072","Voices from Colonial America","Delaware 1638-1776","National Geographic Kids","","","","5.0","1","2022/03/19"
"1073","","The Crescent Obscured: The United States and the Muslim World, 1776-1815","Robert J. Allison","History","North American Hi...","American History","3.7","47","2022/03/19"
"1074","","If You Were There in 1776","Barbara Brenner","History","Nonfiction","North American Hi...","3.78","23","2022/03/19"
"1075","","Gap Creek","Robert Morgan","Fiction","Historical","Historical Fiction","3.74","51369","2022/03/19"
"1076","","Gap Creek","Robert Morgan","Fiction","Historical","Historical Fiction","3.74","51369","2022/03/19"
"1077","","Gap Creek","Robert Morgan","Fiction","Historical","Historical Fiction","3.74","51369","2022/03/19"
"1078","House of Earth","The Good Earth","Pearl S. Buck","Classics","Fiction","Historical","3.99","235221","2022/03/19"
"1079","","For the Good of the Earth and Sun: Teaching Poetry","Georgia Heard","Poetry","Teaching","Education","4.28","80","2022/03/19"
"1080","","The Good Earth (Cliffs Notes)","Stephen Veo Huntley","","","","4.0","11","2022/03/19"
"1081","","The Eco-Foods Guide: What's Good for the Earth is Good for You!","Cynthia Barstow","","","","3.09","11","2022/03/19"
"1082","House of Earth","The Good Earth","Pearl S. Buck","Classics","Fiction","Historical","3.99","235224","2022/03/19"
"1083","House of Earth","The Good Earth","Pearl S. Buck","Classics","Fiction","Historical","3.99","235224","2022/03/19"
"1084","","From the Good Earth: A Celebration of Growing Food Around the World","Michael Ableman","Nonfiction","Food and Drink","Food","4.22","37","2022/03/19"
"1085","House of Earth","The Good Earth","Pearl S. Buck","Classics","Fiction","Historical","3.99","235224","2022/03/19"
"1086","","Walk Gently This Good Earth","Margaret Craven","Fiction","","","3.47","91","2022/03/19"
"1087","","","","","","","","","2022/03/19"
"1088","","The Purpose-Driven Life","Rick Warren","Christian","Nonfiction","Religion","3.95","252376","2022/03/19"
"1089","","Daily Inspiration for the Purpose Driven Life: Scriptures and Reflections from the 40 Days of Purpose","Rick Warren","Christian","Religion","Religion","4.4","3122","2022/03/19"
"1090","","Purpose Driven Life - For Commuters: What on Earth Am I Here For?","Rick Warren","Christian","Nonfiction","Religion","3.95","252376","2022/03/19"
"1091","","Purpose Driven Life Journal: What on Earth Am I Here For?","Rick Warren","Christian","Self Help","Spirituality","4.23","1303","2022/03/19"
"1092","","","","","","","","","2022/03/19"
"1093","","Purpose Driven Life","Rick Warren","Christian","Nonfiction","Religion","3.95","252376","2022/03/19"
"1094","","","","","","","","","2022/03/19"
"1095","","A Catholic Perspective On The Purpose Driven Life","Joseph M. Champlin","","","","3.85","20","2022/03/19"
"1096","","Daily Inspiration for the Purpose Driven Life","Rick Warren","Christian","Religion","Religion","4.4","3122","2022/03/19"
"1097","","Fast Food Nation: The Dark Side of the All-American Meal","Eric Schlosser","Nonfiction","Food and Drink","Food","3.75","203889","2022/03/19"
"1098","","Fast Food Nation: The Dark Side of the All-American Meal","Eric Schlosser","Nonfiction","Food and Drink","Food","3.75","203889","2022/03/19"
"1099","","Fast Food Nation: What The All-American Meal is Doing to the World","Eric Schlosser","Nonfiction","Food and Drink","Food","3.75","203889","2022/03/19"
"1100","","Fast Food Nation: The Dark Side of the All-American Meal","Eric Schlosser","Nonfiction","Food and Drink","Food","3.75","203889","2022/03/19"
"1101","","Fast Food/ Fast Food Nation (Actualidad)","Eric Schlosser","Nonfiction","Food and Drink","Food","3.75","203889","2022/03/19"
"1102","","Fast Food Nation: What the All-American Meal Is Doing to the World","Eric Schlosser","Nonfiction","Food and Drink","Food","3.75","203889","2022/03/19"
"1103","","Snow Flower and the Secret Fan","Lisa See","Historical","Historical Fiction","Fiction","4.08","356523","2022/03/19"
"1104","","Do You Want to Know a Secret?: The Story of the Official George Harrison Fan Club","Pat Kinzer Mancuso","","","","5.0","4","2022/03/19"
"1105","","","","","","","","","2022/03/19"
"1106","","Secrets of the Super [Football] Athletes: Tips for Fans and Players","Abbot Solomon","","","","5.0","1","2022/03/19"
"1107","","Grandma's Little Secrets","Fan B. Smith","","","","0.0","0","2022/03/19"
"1108","","All Men Have Secrets","Tom Gallagher","Music","European Literature","British Literature","3.89","37","2022/03/19"
"1109","","Kakyō Shōhō No Hiden: Chūgoku Koten No Chie","Kazuo Matsumoto","","","","0.0","0","2022/03/19"
"1110","","The Broker","John Grisham","Fiction","Thriller","Mystery","3.8","87787","2022/03/19"
"1111","","The Power Broker: Robert Moses and the Fall of New York","Robert A. Caro","History","Biography","Nonfiction","4.4","17875","2022/03/19"
"1112","","The Complete Idiot's Guide to Success as a Mortgage Broker","Daniel S. Kahn","Business","","","2.6","5","2022/03/19"
"1113","","21 Things I Wish My Broker Had Told Me: Practical Advice for New Real Estate Professionals","Frank Cook","Business","Reference","","3.55","99","2022/03/19"
"1114","","So You Want to Be a Mortgage Broker","Ameen Kamadia","","","","1.6","5","2022/03/19"
"1115","","Body Brokers: Inside America's Underground Trade in Human Remains","Annie Cheney","Nonfiction","Crime","True Crime","3.8","281","2022/03/19"
"1116","","The Devil's Broker: Seeking Gold, God, and Glory in Fourteenth- Century Italy","Frances Stonor Saunders","History","Cultural","Italy","3.92","339","2022/03/19"
"1117","Christian Gillette","The Power Broker: A Novel","Stephen W. Frey","Fiction","Thriller","Mystery","3.77","929","2022/03/19"
"1118","","Broker to Broker: Management Lessons from America's Most Successful Real Estate Companies","Robert Freedman","","","","3.9","10","2022/03/19"
"1119","","The Rational Guide to SQL Server 2005 Service Broker (Rational Guides)","Roger Wolter","Computer Science","Programming","","3.38","8","2022/03/19"
"1120","","Body For Life: 12 Weeks to Mental and Physical Strength","Bill Phillips","Health","Nonfiction","Sports","3.73","4156","2022/03/19"
"1121","","Body for Life for Women: A Woman's Plan for Physical and Mental Transformation","Pamela Peeke","Nonfiction","Health","Sports","3.65","591","2022/03/19"
"1122","","Body for Life Success Journal","Bill Phillips","Sports","Fitness","Nonfiction","4.06","189","2022/03/19"
"1123","","Eating for Life: Your Guide to Great Health, Fat Loss and Increased Energy!","Bill Phillips","Food and Drink","Cookbooks","Health","3.97","842","2022/03/19"
"1124","","Body for Life for Women: 12 Weeks to a Firm, Fit, Fabulous Body at Any Age","Pamela Peeke","Nonfiction","Health","Sports","3.65","591","2022/03/19"
"1125","","Body Life: The Book That Inspired a Return to the Church's Real Meaning and Mission","Ray C. Stedman","Christian","Religion","Theology","4.19","97","2022/03/19"
"1126","","One Body, One Life: Six Weeks to the New You","Gregory Joujon-Roche","","","","3.3","10","2022/03/19"
"1127","","Body Piercing Saved My Life: Inside the Phenomenon of Christian Rock","Andrew Beaujon","Music","Nonfiction","Religion","3.62","300","2022/03/19"
"1128","","Life in His Body","David Finnell","","","","3.6","10","2022/03/19"
"1129","","Bill Phillips Body For Life Two-Book Set (Body For Life, Body for Life Success Journal)","Bill Phillips","","","","4.38","13","2022/03/19"
"1130","","The Warren Buffett Way","Robert G. Hagstrom","Economics","Finance","Business","4.15","14886","2022/03/19"
"1131","","The Warren Buffett Portfolio: Mastering the Power of the Focus Investment Strategy","Robert G. Hagstrom","Economics","Finance","Business","4.21","1533","2022/03/19"
"1132","","Buffettology: The Previously Unexplained Techniques That Have Made Warren Buffett the World's Most Famous Investor","Mary Buffett","Economics","Finance","Business","3.99","3111","2022/03/19"
"1133","","Trade Like Warren Buffett","James Altucher","Business","Economics","Finance","3.59","90","2022/03/19"
"1134","","Warren Buffett Speaks: Wit and Wisdom from the World's Greatest Investor","Janet Lowe","Business","Economics","Finance","3.88","1129","2022/03/19"
"1135","","How to Think Like Benjamin Graham and Invest Like Warren Buffett","Lawrence A. Cunningham","Economics","Finance","Business","3.81","243","2022/03/19"
"1136","","J. K. Lasser's Pick Stocks Like Warren Buffett","Warren Boroson","","","","3.54","13","2022/03/19"
"1137","","Warren Buffett Wealth: Principles and Practical Methods Used by the World's Greatest Investor","Robert P. Miles","Economics","Finance","Nonfiction","3.98","62","2022/03/19"
"1138","","The Warren Buffett CEO: Secrets from the Berkshire Hathaway Managers","Robert P. Miles","Business","Economics","Finance","4.09","282","2022/03/19"
"1139","","The Real Warren Buffett: Managing Capital, Leading People","James O'Loughlin","Economics","Finance","Business","4.03","119","2022/03/19"
"1140","","Of Permanent Value: The Story of Warren Buffett","Andrew Kilpatrick","Biography","Business","Economics","4.06","200","2022/03/19"
"1141","","Warren Buffett: Master of the Market","Jay Steele","Economics","Finance","","3.53","15","2022/03/19"
"1142","","The Winning Investment Habits of Warren Buffett & George Soros","Mark Tier","Economics","Finance","Business","4.02","478","2022/03/19"
"1143","","Warren Buffett: The Good Guy of Wall Street","Andrew Kilpatrick","","","","4.09","11","2022/03/19"
"1144","","Warren Buffett: An Illustrated Biography of the World's Most Successful Investor","Ayano Morio","Biography","Sequential Art","Manga","3.79","121","2022/03/19"
"1145","","A Weekend with Warren Buffett: And Other Shareholder Meeting Adventures","Randy Cepuch","Nonfiction","Business","","3.58","50","2022/03/19"
"1146","","Warren Buffett Speaks: Wit and Wisdom of the World's Greatest Investor","Janet Lowe","Business","Economics","Finance","3.88","1129","2022/03/19"
"1147","","Of Permanent Value: The Story of Warren Buffett, 1998 Edition","Andrew Kilpatrick","Biography","Business","Economics","4.06","200","2022/03/19"
"1148","","Los Ensayos De Warren Buffett","Warren Buffett","Business","Economics","Finance","4.28","6743","2022/03/19"
"1149","","Die Essays Von Warren Buffett","Warren Buffett","Business","Economics","Finance","4.28","6743","2022/03/19"
"1150","","The Buffettology Workbook: Value Investing The Warren Buffett Way","Mary Buffett","Economics","Finance","Business","3.96","124","2022/03/19"
"1151","","Warren Buffett (Business Masterminds)","Robert Heller","Business","","","3.54","57","2022/03/19"
"1152","","Warren Buffett","Robert G. Hagstrom","","","","4.06","47","2022/03/19"
"1153","","The Midas Touch: The Strategies That Have Made Warren Buffett America's Pre-Eminent Investor","John Train","Economics","Finance","Business","3.63","49","2022/03/19"
"1154","","101 Reasons to Own the World's Greatest Investment: Warren Buffett's Berkshire Hathaway","Robert P. Miles","Economics","Finance","","3.69","32","2022/03/19"
"1155","","Buffett: The Making of an American Capitalist","Roger Lowenstein","Biography","Business","Economics","4.13","14644","2022/03/19"
"1156","","Of Permanent Value: The Story of Warren Buffet","Andrew Kilpatrick","Biography","Business","Economics","4.06","200","2022/03/19"
"1157","","Of Permanent Value: The Story of Warren Buffett, Updated and Expanded Edition","Andrew Kilpatrick","Biography","Business","Economics","4.06","200","2022/03/19"
"1158","","Investimentos: Os Segredos De George Soros E Warren Buffett","Mark Tier","Economics","Finance","Business","4.02","478","2022/03/19"
"1159","","Of Permanent Value: The Story of Warren Buffett/More in '04, California Edition","Andrew Kilpatrick","Biography","Business","Economics","4.06","200","2022/03/19"
"1160","","Damn Right!: Behind the Scenes with Berkshire Hathaway Billionaire Charlie Munger","Janet Lowe","Business","Biography","Economics","4.17","1879","2022/03/19"
"1161","","Of Permanent Value : The Story of Warren Buffett/Monster Millennium Edition","Andrew Kilpatrick","Biography","Business","Economics","4.06","200","2022/03/19"
"1162","","Monkey Business: Swinging Through the Wall Street Jungle","John Rolfe","Economics","Finance","Business","3.96","5241","2022/03/19"
"1163","","Monkey Business","Wallace Edwards","Childrens","Picture Books","Childrens","4.19","149","2022/03/19"
"1164","","Monkey Business: True Story of the Scopes Trial","Marvin N. Olasky","Philosophy","Science","","3.17","29","2022/03/19"
"1165","","Mice, Morals, & Monkey Business","Christopher Wormell","Childrens","Childrens","Picture Books","3.71","41","2022/03/19"
"1166","Hank the Cowdog","Hank the Cowdog and Monkey Business","John R. Erickson","Childrens","Mystery","Humor","4.09","616","2022/03/19"
"1167","Junie B. Jones","Junie B. Jones and a Little Monkey Business","Barbara Park","Childrens","Fiction","Childrens","4.01","12956","2022/03/19"
"1168","","Monkey Business: Are Yor Controlling Events or Are Events Controlling You?","William Oncken III","Business","Management","","4.1","21","2022/03/19"
"1169","","Monkey Business","Sarah Mlynowski","Womens Fiction","Chick Lit","Fiction","3.67","3417","2022/03/19"
"1170","","Monkey Business","J. Otto Seibold","Childrens","Picture Books","Childrens","3.72","43","2022/03/19"
"1171","Liar's Poker","Liar's Poker","Michael  Lewis","Nonfiction","Business","Economics","4.14","89995","2022/03/19"
"1172","Liar's Poker","Liar's Poker","Michael  Lewis","Nonfiction","Business","Economics","4.14","89997","2022/03/19"
"1173","Liar's Poker","Liar's Poker","Michael  Lewis","Nonfiction","Business","Economics","4.14","89997","2022/03/19"
"1174","","Liars Poker: A Winning Strategy","John Archer","","","","3.86","29","2022/03/19"
"1175","","Liar's Poker: The Great Powers, Yugoslavia and the Wars of the Future","Michel Collon","","","","4.0","9","2022/03/19"
"1176","Liar's Poker","Liars Poker Rising Through The Wreckage/International Edition","Michael  Lewis","Nonfiction","Business","Economics","4.14","89997","2022/03/19"
"1177","Henry Garnish","Liar's Poker: A Harry Garnish Mystery","Frank McConnell","","","","3.31","13","2022/03/19"
"1178","","Weight Watchers Simply the Best Italian","Weight Watchers","Food and Drink","Cookbooks","Nonfiction","3.79","38","2022/03/19"
"1179","","Simply Italian: 100 Easy-To-Make, Zesty, Satisfying Favorites","Ruth Glick","","","","5.0","1","2022/03/19"
"1180","","Simply Bruschetta: Garlic Toast the Italian Way","Vittorio Pellegrino","Food and Drink","Cooking","","3.75","4","2022/03/19"
"1181","","Simply Italian: Easy Recipes That Are Quick to Prepare, Low in Calories, and Kind to Your Budget","Valentina Harris","","","","4.0","1","2022/03/19"
"1182","","Simply Italian More Than Quick and Easy","Gina Puliciano","","","","0.0","0","2022/03/19"
"1183","","Simply Italian: Easy Recipes That Are Quick to Prepare, Low in Calories, and Kind to Your Budget","Valentina Harris","","","","4.0","1","2022/03/19"
"1184","","Simply Italian","Sophie Braimbridge","Food and Drink","Cookbooks","","3.91","11","2022/03/19"
"1185","","Cucina Fresca: Italian Food, Simply Prepared","Viana La Place","Food and Drink","Cookbooks","Food and Drink","4.23","44","2022/03/19"
"1186","","Simply Pasta & Italian","Helen Walters","","","","5.0","1","2022/03/19"
"1187","","Simply Sauté: Fast, Easy, and Healthy Italian Cooking -- All in One Pan","Silvia Bianco","","","","4.0","2","2022/03/19"
"1188","","Risotto: 30 Simply Delicious Vegetarian Recipes from an Italian Kitchen","Ursula Ferrigno","Food and Drink","Cookbooks","Food and Drink","4.08","12","2022/03/19"
"1189","","Simply Tuscan: Recipes for a Well-Lived Life","Pino Luongo","Food and Drink","Cookbooks","European Literature","3.59","22","2022/03/19"
"1190","","Simply Sicilian: Family Recipes","Carol Cappelline Schulte","","","","0.0","0","2022/03/19"
"1191","","Giada's Family Dinners","Giada De Laurentiis","Food and Drink","Cookbooks","Food and Drink","3.98","15177","2022/03/19"
"1192","","Everyday Italian: 125 Simple and Delicious Recipes","Giada De Laurentiis","Food and Drink","Cookbooks","Food and Drink","3.89","48740","2022/03/19"
"1193","","Everyday Pasta","Giada De Laurentiis","Food and Drink","Cookbooks","Food and Drink","4.1","9074","2022/03/19"
