"1622","","A Midsummer Night's Dream","William Shakespeare","Classics","Plays","Fiction","3.95","485429","2022/03/19"
"1623","The Living Dead","Night of the Living Dead","John Russo","Horror","Horror","Zombies","4.01","1021","2022/03/19"
"1624","","West with the Night","Beryl Markham","Nonfiction","Autobiography","Memoir","4.12","35287","2022/03/19"
"1625","","Twelfth Night","William Shakespeare","Classics","Plays","Drama","3.97","167295","2022/03/19"
"1626","","Brokeback Mountain: Story to Screenplay","Annie Proulx","Fiction","Short Stories","LGBT","4.13","1451","2022/03/19"
"1627","Wyoming Stories","Brokeback Mountain","Annie Proulx","Fiction","Short Stories","LGBT","3.96","34762","2022/03/19"
"1628","Wyoming Stories","Brokeback Mountain","Annie Proulx","Fiction","Short Stories","LGBT","3.96","34762","2022/03/19"
"1629","Wyoming Stories","Close Range: Brokeback Mountain and Other stories","Annie Proulx","Short Stories","Fiction","Westerns","3.99","15626","2022/03/19"
"1630","Wyoming Stories","Brokeback Mountain: Secreto en la Montaña","Annie Proulx","Short Stories","Fiction","Westerns","3.99","15626","2022/03/19"
"1631","Wyoming Stories","Brokeback Mountain","Annie Proulx","Fiction","Short Stories","LGBT","3.96","34762","2022/03/19"
"1632","Wyoming Stories","Brokeback Mountain","Annie Proulx","Fiction","Short Stories","LGBT","3.96","34762","2022/03/19"
"1633","","Getting Things Done: The Art of Stress-Free Productivity","David  Allen","Nonfiction","Business","Productivity","3.99","144037","2022/03/19"
"1634","","Getting Things Done When You Are Not in Charge","Geoffrey M. Bellman","Business","Leadership","Self Help","3.43","109","2022/03/19"
"1635","","Execution: The Discipline of Getting Things Done","Larry Bossidy","Business","Leadership","Nonfiction","3.87","24913","2022/03/19"
"1636","","The Complete Idiot's Guide to Getting Things Done","Jeff Davidson","Productivity","Nonfiction","","3.93","29","2022/03/19"
"1637","","The Three Ways of Getting Things Done: Hierarchy, Heterarchy and Responsible Autonomy in Organizations","Gerard Fairtlough","Business","Management","","4.3","10","2022/03/19"
"1638","","Results That Matter: Improving Communities by Engaging Citizens, Measuring Performance, and Getting Things Done","Paul D. Epstein","","","","4.08","13","2022/03/19"
"1639","","The Leader's Handbook: Making Things Happen, Getting Things Done","Peter R. Scholtes","Leadership","Business","Business","4.18","141","2022/03/19"
"1640","","Execution: The Discipline Of Getting Things Done","Larry Bossidy","Business","Leadership","Nonfiction","3.87","24913","2022/03/19"
"1641","","Guide to Getting Things Done","Edwin C. Bliss","","","","0.0","0","2022/03/19"
"1642","","Formas breves","Ricardo Piglia","Nonfiction","Literature","European Literature","4.22","423","2022/03/19"
"1643","","El último lector","Ricardo Piglia","Nonfiction","European Literature","Spanish Literature","4.14","591","2022/03/19"
"1644","","The Absent City","Ricardo Piglia","Fiction","Science Fiction","Novels","3.76","801","2022/03/19"
"1645","","Money to Burn","Ricardo Piglia","Fiction","European Literature","Spanish Literature","3.77","1956","2022/03/19"
"1646","","Respiración artificial","Ricardo Piglia","Fiction","European Literature","Spanish Literature","3.98","2081","2022/03/19"
"1647","","Ricardo Piglia y La Cultura de La Contravenc","Nicolas Bratosevich","","","","0.0","0","2022/03/19"
"1648","","Poéticas en suspenso: Migraciones narrativas en Ricardo Piglia, Andres Rivera y Juan José Saer","Edgardo H. Berg","","","","4.0","1","2022/03/19"
"1649","","Ricardo Piglia y Sus Precursores","Maria Antonieta Pereira","","","","0.0","0","2022/03/19"
"1650","","Peripheral (Post) Modernity: The Syncretist Aesthetics of Borges, Piglia, Kalokyris and Kyriakidis","Eleni Kefala","","","","0.0","0","2022/03/19"
"1651","","Argentina-S: Ricardo Piglia Dialoga Con la Generacion del 37 en la Discontinuidad","Laura DeMaria","","","","0.0","0","2022/03/19"
"1652","","Modos de ensayo: De Borges a Piglia","Alberto Giordano","","","","4.25","4","2022/03/19"
"1653","","Narrativas De La Guerra Sucia En La Argentina: Piglia, Saer, Vale","Jorgelina Corbatta","","","","2.0","1","2022/03/19"
"1654","","Plata quemada","Ricardo Piglia","Fiction","European Literature","Spanish Literature","3.77","1956","2022/03/19"
"1655","","Diccionario de La Novela de Macedonio Fernandez","Ricardo Piglia","","","","4.0","1","2022/03/19"
"1656","","Ficciones Argentinas: Antologia de Lecturas Criticas","Grupo Editorial Norma","","","","3.0","2","2022/03/19"
"1657","","Feeding Frenzy: Attack Journalism and American Politics","Larry J. Sabato","Politics","","","3.63","41","2022/03/19"
"1658","","American Government: Continuity and Change, Alternate Edition","Karen O'Connor","","","","2.77","26","2022/03/19"
"1659","","American Government; Continuity and Change","Karen O'Connor","","","","2.77","26","2022/03/19"
"1660","","El Túnel","Ernesto Sabato","Fiction","Classics","European Literature","4.04","56315","2022/03/19"
"1661","","No Excuses: Antonio Sabato Jr. Workout For Life","Antonio Sabato Jr.","","","","3.55","11","2022/03/19"
"1662","","Aleppo Tales","Haim Sabato","","","","4.22","49","2022/03/19"
"1663","","Adjusting Sights","Haim Sabato","Cultural","Israel","Fiction","4.07","157","2022/03/19"
"1664","","Essentials of American and Texas Government: Continuity and Change","Karen O'Connor","","","","0.0","0","2022/03/19"
"1665","","American Government: Continuity And Change","Karen O'Connor","","","","2.77","26","2022/03/19"
"1666","Sobre héroes y tumbas","On Heroes and Tombs","Ernesto Sabato","Fiction","Classics","Cultural","4.27","10427","2022/03/19"
"1667","","El túnel","Ernesto Sabato","Fiction","Classics","European Literature","4.04","56315","2022/03/19"
"1668","","The Tunnel","Ernesto Sabato","Fiction","Classics","European Literature","4.04","56315","2022/03/19"
"1669","","Lo Mejor De Ernesto Sabato","Ernesto Sabato","","","","4.16","25","2022/03/19"
"1670","","Antes del fin","Ernesto Sabato","Nonfiction","Cultural","Latin American","4.02","2217","2022/03/19"
"1671","","Obra Completa Narrativa","Ernesto Sabato","European Literature","Spanish Literature","","4.75","12","2022/03/19"
"1672","","Paginas de Ernesto Sabato","Ernesto Sabato","","","","3.4","5","2022/03/19"
"1673","","Uno y el Universo","Ernesto Sabato","Philosophy","Nonfiction","Writing","3.88","542","2022/03/19"
"1674","","Genio y Figura de Ernesto Sabato","Carlos Catania","","","","2.5","2","2022/03/19"
"1675","","Medio Siglo Con Sabato: Entrevistas","Julia Constenla","","","","3.57","7","2022/03/19"
"1676","","El túnel","Ernesto Sabato","Fiction","Classics","European Literature","4.04","56315","2022/03/19"
"1677","Sobre héroes y tumbas","Sobre héroes y tumbas","Ernesto Sabato","Fiction","Classics","Cultural","4.27","10427","2022/03/19"
"1678","","Ernesto Sabato","Harley D. Oberhelman","","","","0.0","0","2022/03/19"
"1679","","LA Signification Del Genero: Estudio Semiotico De Las Novelas Y Ensayos De Ernesto Sabato (Coleccion Polymita)","Nicasio Urbina","","","","5.0","1","2022/03/19"
"1680","","Ernesto Sabato: La Littérature Comme Absolu","Daniel-Henri Pageaux","","","","0.0","0","2022/03/19"
"1681","","The Confessions (Works of Saint Augustine 1)","Augustine of Hippo","Philosophy","Classics","Religion","3.92","55870","2022/03/19"
"1682","","The Confessions of St. Augustine","Augustine of Hippo","Philosophy","Classics","Religion","3.92","55870","2022/03/19"
"1683","","The Confessions of Saint Augustine","Augustine of Hippo","Philosophy","Classics","Religion","3.92","55870","2022/03/19"
"1684","","The City of God","Augustine of Hippo","Philosophy","Religion","Theology","3.89","11509","2022/03/19"
"1685","","The Enchiridion on Faith Hope and Love (Augustine Series 1)","Augustine of Hippo","Religion","Theology","Religion","4.1","631","2022/03/19"
"1686","","Augustine of Hippo: A Biography","Peter R.L. Brown","Biography","History","Religion","4.29","1941","2022/03/19"
"1687","","Augustine Came to Kent","Barbara Willard","Historical","Historical Fiction","Academic","3.65","319","2022/03/19"
"1688","","Trinity (Works of Saint Augustine)","Augustine of Hippo","Religion","Theology","Philosophy","4.34","994","2022/03/19"
"1689","","The Confessions","Augustine of Hippo","Philosophy","Classics","Religion","3.92","55870","2022/03/19"
"1690","","The City of God against the Pagans","Augustine of Hippo","Philosophy","Religion","Theology","3.89","11509","2022/03/19"
"1691","","On Christian Teaching","Augustine of Hippo","Religion","Theology","Religion","4.04","3243","2022/03/19"
"1692","","The Political Writings of St. Augustine","Augustine of Hippo","Philosophy","Politics","Religion","3.84","342","2022/03/19"
"1693","","On Christian Doctrine","Augustine of Hippo","Religion","Theology","Religion","4.04","3243","2022/03/19"
"1694","","The Confessions of Saint Augustine","Augustine of Hippo","Philosophy","Classics","Religion","3.92","55870","2022/03/19"
"1695","","Augustine, the Farmer's Boy of Tagaste","P. de Zeeuw","History","Biography","Church","3.64","73","2022/03/19"
"1696","","Augustine's Laws","Norman R. Augustine","Business","Nonfiction","Science","4.03","76","2022/03/19"
"1697","","CliffsNotes on St. Augustine's Confessions","Stacy Magedanz","","","","3.4","5","2022/03/19"
"1698","","Confessions, Books 1-13","Augustine of Hippo","Philosophy","Classics","Religion","3.92","55870","2022/03/19"
"1699","","Earlier Writings","Augustine of Hippo","Religion","Theology","Religion","3.73","45","2022/03/19"
"1700","","On Free Choice of the Will","Augustine of Hippo","Philosophy","Religion","Theology","3.92","1396","2022/03/19"
"1701","","Augustine: A New Biography","James J. O'Donnell","Biography","History","Religion","3.67","170","2022/03/19"
"1702","","Saint Augustine","Garry Wills","Biography","Religion","History","3.54","415","2022/03/19"
"1703","","Augustine: A Very Short Introduction","Henry Chadwick","Philosophy","Religion","Religion","3.7","366","2022/03/19"
"1704","","Day by Day with Saint Augustine","Donald X. Burt","","","","4.5","14","2022/03/19"
"1705","","Confessions","Augustine of Hippo","Philosophy","Classics","Religion","3.92","55870","2022/03/19"
"1706","","Later Works","Augustine of Hippo","Religion","Theology","Religion","4.11","37","2022/03/19"
"1707","","On Genesis/A Refutation of the Manichees/The Unfinished Literal Meaning of Genesis (Works of St Augustine 1)","Augustine of Hippo","Religion","Theology","Philosophy","4.0","40","2022/03/19"
"1708","","Augustine: Ancient Thought Baptized","John M. Rist","Philosophy","","","4.2","5","2022/03/19"
"1709","","Kitchen Confidential: Adventures in the Culinary Underbelly","Anthony Bourdain","Nonfiction","Food and Drink","Food","4.1","261108","2022/03/19"
"1710","","Confesiones de un chef","Anthony Bourdain","Nonfiction","Food and Drink","Food","4.1","261108","2022/03/19"
"1711","","","","","","","","","2022/03/19"
"1712","","Memoirs of a Midget","Walter de la Mare","Fiction","Classics","Literature","3.66","217","2022/03/19"
"1713","","The Metamorphoses of Ovid","Ovid","Classics","Poetry","Fantasy","4.07","63136","2022/03/19"
"1714","","Metamorphoses","Ovid","Classics","Poetry","Fantasy","4.07","63136","2022/03/19"
"1715","","Metamorphoses","Ovid","Classics","Poetry","Fantasy","4.07","63136","2022/03/19"
"1716","","Love & Transformation: An Ovid Reader","Richard A. LaFleur","","","","4.0","41","2022/03/19"
"1717","","Tales from Ovid","Ovid","Poetry","Classics","Fantasy","4.25","2506","2022/03/19"
"1718","","Metamorphoses","Ovid","Classics","Poetry","Fantasy","4.07","63136","2022/03/19"
"1719","","Amores & Metamorphoses: Selections","Ovid","Poetry","Classics","","4.26","46","2022/03/19"
"1720","","Ovid's Metamorphoses: Books 1-5","Ovid","Classics","Poetry","Fantasy","4.24","267","2022/03/19"
"1721","","Ovid’s Metamorphoses: Books 6-10","Ovid","Poetry","Classics","Humanities","4.31","42","2022/03/19"
"1722","","Latin Via Ovid: A First Course","Norma Goldman","Humanities","Language","Nonfiction","4.33","85","2022/03/19"
"1723","","The Art of Love","Ovid","Poetry","Classics","Nonfiction","3.79","5527","2022/03/19"
"1724","","The Metamorphoses of Ovid","Ovid","Classics","Poetry","Fantasy","4.07","63136","2022/03/19"
"1725","","The Art of Love and Other Poems","Ovid","Poetry","Classics","Love","4.05","107","2022/03/19"
"1726","","Ovid's ""Metamorphoses""","Ovid","Classics","Poetry","Fantasy","4.07","63136","2022/03/19"
"1727","","The Erotic Poems","Ovid","Poetry","Classics","Romance","4.09","2296","2022/03/19"
"1728","","The Poems of Exile: Tristia and the Black Sea Letters","Ovid","Poetry","Classics","History","4.04","582","2022/03/19"
"1729","","Metamorphoses: Volume 2, Books IX-XV","Ovid","Poetry","Classics","Philosophy","4.49","71","2022/03/19"
"1730","","Metamorphoses: Volume I, Books I-VIII","Ovid","Classics","Fantasy","Mythology","4.43","832","2022/03/19"
"1731","","Practice! Practice!: A Latin Via Ovid Workbook (Revised Ed.)","Norma Goldman","Humanities","Language","","4.08","13","2022/03/19"
"1732","","Tristia. Ex Ponto","Ovid","Poetry","Classics","History","4.04","582","2022/03/19"
"1733","","Silent Screens: The Decline and Transformation of the American Movie Theater","Michael C.J. Putnam","Culture","Film","Art","4.07","15","2022/03/19"
"1734","","Virgil's Aeneid: Interpretation and Influence","Michael C.J. Putnam","","","","4.11","9","2022/03/19"
"1735","","Short Epics","Maffeo Vegio","","","","4.5","6","2022/03/19"
"1736","","Aftifices of Eternity: Horace's Fourth Book of Odes","Michael C.J. Putnam","","","","4.25","4","2022/03/19"
"1737","Martin Classical Lectures","Poetic Interplay: Catullus and Horace","Michael C.J. Putnam","","","","3.5","4","2022/03/19"
"1738","","Virgil's Pastoral Art","Michael C.J. Putnam","","","","0.0","0","2022/03/19"
"1739","","Virgil's Poem of the Earth: Studies in the Georgics","Michael C.J. Putnam","","","","0.0","0","2022/03/19"
"1740","","Essays On Latin Lyric, Elegy, And Epic","Michael C.J. Putnam","","","","5.0","1","2022/03/19"
"1741","","Horace's ""Carmen Saeculare"": Ritual Magic and the Poet`s Art","Michael C.J. Putnam","","","","5.0","2","2022/03/19"
"1742","","The Virgilian Tradition: The First Fifteen Hundred Years","Jan M. Ziolkowski","","","","3.31","13","2022/03/19"
"1743","","Virgil's Epic Designs: Ekphrasis in the Aeneid","Michael C.J. Putnam","","","","4.0","1","2022/03/19"
"1744","","Tibullus: A Commentary","Michael C.J. Putnam","Classics","","","3.71","7","2022/03/19"
"1745","","The Poetry of the Aeneid: On the Institution of Authorship","Michael C.J. Putnam","","","","4.0","3","2022/03/19"
"1746","","In Spite of Innocence","Michael L. Radelet","Nonfiction","Law","Crime","4.3","27","2022/03/19"
"1747","","The Future of Investment Management","Association for Investment Management an","","","","0.0","0","2022/03/19"
"1748","","Singers, Heroes, and Gods in the Odyssey","Charles Segal","","","","4.63","8","2022/03/19"
"1749","","Tragedy and Civilization: An Interpretation of Sophocles","Charles Segal","Philosophy","Criticism","Tragedy","4.47","15","2022/03/19"
"1750","","Dionysiac Poetics and Euripides' Bacchae","Charles Segal","Nonfiction","Criticism","Tragedy","4.5","16","2022/03/19"
"1751","Twayne's Masterwork Studies","Oedipus Tyrannus: Tragic Heroism and the Limits of Knowledge","Charles Segal","","","","4.13","24","2022/03/19"
"1752","The Theban Plays","Antigone","Sophocles","Classics","Plays","Drama","3.67","123230","2022/03/19"
"1753","","Poetry and Myth in Ancient Pastoral: Essays on Theocritus and Virgil","Charles Segal","","","","4.33","3","2022/03/19"
"1754","","Lucretius on Death and Anxiety: Poetry and Philosophy in de Rerum Natura","Charles Segal","Philosophy","","","4.33","9","2022/03/19"
"1755","","Pindar's Mythmaking: The Fourth Pythian Ode","Charles Segal","","","","4.25","4","2022/03/19"
"1756","","Dionysiac Poetics And Euripides' Bacchae","Charles Segal","Nonfiction","Criticism","Tragedy","4.5","16","2022/03/19"
"1757","","Aglaia: The Poetry of Alcman, Sappho, Pindar, Bacchylides, and Corinna","Charles Segal","","","","4.75","4","2022/03/19"
"1758","","Sophocles' Tragic World: Divinity, Nature, Society","Charles Segal","Nonfiction","","","4.11","9","2022/03/19"
"1759","","Euripides and the Poetics of Sorrow: Art, Gender, and Commemoration in Alcestis, Hippolytus, and Hecuba","Charles Segal","","","","4.33","6","2022/03/19"
"1760","","Orpheus: The Myth Of The Poet","Charles Segal","Nonfiction","Fantasy","Mythology","4.0","17","2022/03/19"
"1761","The Theban Plays","Antigone","Sophocles","Classics","Plays","Drama","3.67","123230","2022/03/19"
"1762","","Conversations with Lincoln","Abraham Lincoln","Biography","","","4.0","4","2022/03/19"
"1763","","Language and Desire in Seneca's ""Phaedra""","Charles Segal","","","","3.5","4","2022/03/19"
"1764","","Preventing Medication Errors and Improving Drug Therapy Outcomes: A Management Systems Approach","Charles D. Hepler","","","","2.67","3","2022/03/19"
"1765","","The Rhetoric Of Imitation: Genre And Poetic Memory In Virgil And Other Latin Poets","Gian Biagio Conte","","","","4.22","9","2022/03/19"
"1766","","The AutoCAD 3D Book","George O. Head","","","","1.0","1","2022/03/19"
"1767","","Instant Songwriting with the Piano","Charles Segal","","","","0.0","0","2022/03/19"
"1768","","","","","","","","","2022/03/19"
"1769","","Electronic Structure: Basic Theory and Practical Methods","Richard M. Martin","Science","Physics","","4.31","16","2022/03/19"
"1770","","The Tower","Richard Martin Stern","Fiction","Thriller","Action","3.42","420","2022/03/19"
"1771","","Object-Oriented Programming in C++","Richard Johnsonbaugh","","","","3.88","16","2022/03/19"
"1772","","The Tower","Richard Martin Stern","Fiction","Thriller","Action","3.42","420","2022/03/19"
"1773","","Fanaroff and Martin's Neonatal-Perinatal Medicine: Diseases of the Fetus and Infant (Expert Consult - Online and Print) (2-Volume Set)","Avroy A. Fanaroff","","","","5.0","4","2022/03/19"
"1774","","Humanity Dick: A Biography of Richard Martin, M. P., 1754-1834","Shevawn Lynam","History","","","3.67","3","2022/03/19"
"1775","","The Language of Heroes","Richard P. Martin","","","","4.33","3","2022/03/19"
"1776","Christian Heroes: Then & Now","Cameron Townsend: Good News in Every Language","Janet Benge","Biography","Christian","Nonfiction","4.07","712","2022/03/19"
"1777","","Einstein's Heroes: Imagining the World Through the Language of Mathematics","Robyn Arianrhod","Science","History","Nonfiction","3.72","102","2022/03/19"
"1778","ржЯрзЗржирж┐ржжрж╛","4 Heroes and a Haunted House","Narayan Gangopadhyay","Humor","Comedy","Adventure","4.48","651","2022/03/19"
"1779","","The Heroes of Shakespeare's Tragedies","Victor L. Cahn","Drama","Contemporary","","3.55","2805","2022/03/19"
"1780","","The Refining Fire: Herakles and Other Heroes in T.S. Eliot's Works","Laura Elizabeth Niesen De Abruna","","","","0.0","0","2022/03/19"
"1781","","Homeric Responses","Gregory Nagy","Humanities","Classical Studies","Poetry","4.42","12","2022/03/19"
"1782","","Comparative Studies in Greek and Indic Meter","Gregory Nagy","","","","4.75","8","2022/03/19"
"1783","Traditions","Homer's Text and Language","Gregory Nagy","","","","4.67","6","2022/03/19"
"1784","","In A Rehearsal Room: A Portrait Of Two Dancers, Cynthia Gregory And Ivan Nagy, And Of A Dance Film In The Making, In A Rehearsal Room, Choreographed By William Carter And Directed By David Hahn","Susan Cook","","","","4.0","7","2022/03/19"
"1785","","The Best of the Achaeans: Concepts of the Hero in Archaic Greek Poetry","Gregory Nagy","History","Poetry","Nonfiction","4.24","54","2022/03/19"
"1786","","Homeric Questions","Gregory Nagy","Classics","Nonfiction","Humanities","4.25","32","2022/03/19"
"1787","","Antiquities","Gregory Nagy","","","","4.5","2","2022/03/19"
"1788","","Archaic Period (Greek Literature, Volume 2)","Gregory Nagy","","","","5.0","1","2022/03/19"
"1789","","Greek Literature in the Classical Period: The Prose of Historiography and Oratory: Greek Literature","Gregory Nagy","","","","5.0","2","2022/03/19"
"1790","","Greek Literature in the Roman Period and in Late Antiquity: Greek Literature","Gregory Nagy","","","","5.0","2","2022/03/19"
"1791","","Greek Literature in the Byzantine Period: Greek Literature","Gregory Nagy","","","","5.0","2","2022/03/19"
"1792","","Preliterate Period (Greek Literature, Volume 1)","Gregory Nagy","","","","5.0","1","2022/03/19"
"1793","","Roman Period (Greek Literature, Volume 6)","Gregory Nagy","","","","4.0","4","2022/03/19"
"1794","","Greek Dialects and the Transformation of an Indo-European Process","Gregory Nagy","","","","5.0","2","2022/03/19"
"1795","","Classical Period : Poetics of Drama (Greek Literature, Volume 3)","Gregory Nagy","","","","5.0","1","2022/03/19"
"1796","","The Iliad","Homer","Classics","Poetry","Fiction","3.89","394292","2022/03/19"
"1797","","Pindar's Homer: The Lyric Possession of an Epic Past","Gregory Nagy","Poetry","","","4.62","13","2022/03/19"
"1798","","Plato's Rhapsody and Homer's Music: The Poetics of the Panathenaic Festival in Classical Athens","Gregory Nagy","","","","4.67","3","2022/03/19"
"1799","","Language, Sexuality, Narrative: The Oresteia","Simon Goldhill","","","","3.33","3","2022/03/19"
"1800","","Love, Sex & Tragedy: How the Ancient World Shapes Our Lives","Simon Goldhill","History","Classics","Nonfiction","3.79","178","2022/03/19"
"1801","","Reading Greek Tragedy","Simon Goldhill","Nonfiction","Classics","Criticism","4.05","38","2022/03/19"
"1802","","The Poet's Voice: Essays on Poetics and Greek Literature","Simon Goldhill","","","","4.0","6","2022/03/19"
"1803","","Love, Sex and Tragedy: Why Classics Matter","Simon Goldhill","History","Classics","Nonfiction","3.79","178","2022/03/19"
"1804","","Who Needs Greek? Contests in the Cultural History of Hellenism","Simon Goldhill","","","","3.27","11","2022/03/19"
"1805","The W. B. Stanford Memorial Lectures","Foucault's Virginity: Ancient Erotic Fiction & the History of Sexuality","Simon Goldhill","Philosophy","Gender and Sexuality","History","3.71","14","2022/03/19"
"1806","","Greek Rhetoric Before Aristotle","Richard Leo Enos","","","","3.78","9","2022/03/19"
"1807","","History of the Progressive Party, 1912-1916.","Amos Richards Eno Pinchot","","","","0.0","0","2022/03/19"
"1808","","Correctional Case Management","Richard Enos","","","","3.0","1","2022/03/19"
"1809","","Alternative Sentencing: Electronically Monitored Correctional Supervision","Richard Enos","","","","0.0","0","2022/03/19"
"1810","","The Literate Mode of Cicero's Legal Rhetoric","Richard Leo Enos","","","","5.0","1","2022/03/19"
"1811","","Oral and Written Communication: Historical Approaches","Richard Leo Enos","","","","0.0","0","2022/03/19"
"1812","","Not One More Death","Brian Eno","Nonfiction","Politics","History","3.87","70","2022/03/19"
"1813","","Strauss: Arabella (Eno 30)","Richard Strauss","Music","","","4.25","4","2022/03/19"
"1814","","2012: The Return of Quetzalcoatl","Daniel Pinchbeck","Nonfiction","Spirituality","Philosophy","3.42","1728","2022/03/19"
"1815","","Breaking Open the Head: A Psychedelic Journey Into the Heart of Contemporary Shamanism","Daniel Pinchbeck","Nonfiction","Spirituality","Philosophy","4.06","3218","2022/03/19"
"1816","","A Psychonaut's Guide to the Invisible Landscape: The Topography of the Psychedelic Experience","Dan Carpenter","Spirituality","Psychology","","3.67","39","2022/03/19"
"1817","","Breaking Open the Head: A Psychedelic Journey from Cynicism to Shamanism","Daniel Pinchbeck","Nonfiction","Spirituality","Philosophy","4.06","3218","2022/03/19"
"1818","","Jeff Koons/Andy Warhol: Flowers","Gagosian Gallery","","","","4.25","4","2022/03/19"
"1819","","Abstraction As Figuration, Five Abstract Painters: Primal Denouements:  Linda Gentile, Peter Pinchbeck, Richard Pugliese, Edwin Ruda, Joseph Walentini","Véronique Marion Fóti","","","","0.0","0","2022/03/19"
"1820","","Christopher Pinchbeck And His Family","R.K. Shenton","","","","0.0","0","2022/03/19"
"1821","","The Pinchbeck Masterpiece","Philip Cleife","","","","0.0","0","2022/03/19"
"1822","Open City Magazine","Open City","Daniel Pinchbeck","","","","3.0","1","2022/03/19"
"1823","","Them: Adventures with Extremists","Jon Ronson","Nonfiction","Politics","Writing","3.96","18888","2022/03/19"
"1824","","The Men Who Stare at Goats","Jon Ronson","Nonfiction","History","Politics","3.62","16834","2022/03/19"
"1825","","The Men Who Stare at Goats","Jon Ronson","Nonfiction","History","Politics","3.62","16834","2022/03/19"
"1826","","Maximum Accessibility: Making Your Web Site More Usable for Everyone: Making Your Web Site More Usable for Everyone","John M. Slatin","Science","Technology","Design","3.92","13","2022/03/19"
"1827","","Amazing Rain Forest (Rain Forest Today Discovery Library)","Ted O'Hare","","","","4.0","3","2022/03/19"
"1828","Discovering the Rain Forest","Amazing Rain Forest","Lynn M. Stone","","","","4.25","4","2022/03/19"
"1829","","Splish Splash!: A Book about Rain","Josepha Sherman","Nonfiction","Childrens","Picture Books","3.37","30","2022/03/19"
"1830","","Totally Amazing Rain Forests","Kate Graham","","","","4.67","3","2022/03/19"
"1831","","Amazing Rain","Sam Brown","Sequential Art","Comics","Sequential Art","4.34","76","2022/03/19"
"1832","","Kids' Crafts: Stamp It!: 50 Amazing Projects to Make","Joe Rhatigan","","","","3.5","2","2022/03/19"
"1833","","Out-of-This-World Astronomy: 50 Amazing Activities  Projects","Joe Rhatigan","Science","","","3.8","5","2022/03/19"
"1834","","Gecko Gathering PB","Vanessa Giancamilli","","","","3.0","2","2022/03/19"
