"","4393","","Cien años de soledad","Gabriel García Márquez","1967","Fiction","Classics","Magical Realism","4.1","844129","2022/03/22"
"","4394","","Collected Novellas","Gabriel García Márquez","1990","Fiction","Short Stories","Magical Realism","3.99","1065","2022/03/22"
"","4395","","The Grapes of Wrath","John Steinbeck","1939","Classics","Fiction","Historical","3.99","818659","2022/03/22"
"","4396","","Gabriel Garcia Marquez","Susan Muaddi Darraj","2006","","","","3.71","7","2022/03/22"
"","4397","","The Grapes of Wrath","John Steinbeck","1939","Classics","Fiction","Historical","3.99","818659","2022/03/22"
"","4398","","CliffsNotes on Steinbeck's The Grapes of Wrath","Kelly McGrath Vlcek","","","","","3.93","46","2022/03/22"
"","4399","","The Grapes of Wrath","John Steinbeck","1939","Classics","Fiction","Historical","3.99","818659","2022/03/22"
"","4400","","The Grapes of Wrath","John Steinbeck","1939","Classics","Fiction","Historical","3.99","818659","2022/03/22"
"","4401","","Las Uvas De La Ira","John Steinbeck","1939","Classics","Fiction","Historical","3.99","818659","2022/03/22"
"","4402","","The Grapes of Wrath (SparkNotes Literature Guide)","SparkNotes","","","","","4.16","19","2022/03/22"
"","4403","","The Grapes of Wrath","John Steinbeck","1939","Classics","Fiction","Historical","3.99","818659","2022/03/22"
"","4404","American Gods","American Gods","Neil Gaiman","","Fantasy","Fiction","Fantasy","4.11","834716","2022/03/22"
"","4405","","American Gospel: God, the Founding Fathers, and the Making of a Nation","Jon Meacham","","History","Nonfiction","Religion","3.82","2578","2022/03/22"
"","4406","","East of Eden","John Steinbeck","1952","Classics","Fiction","Historical","4.39","470439","2022/03/22"
"","4407","American Gods","American Gods","Neil Gaiman","2001","Fantasy","Fiction","Fantasy","4.11","834716","2022/03/22"
"","4408","","East of Eden","John Steinbeck","1952","Classics","Fiction","Historical","4.39","470439","2022/03/22"
"","4409","","Under God","Garry Wills","1990","Religion","Politics","History","3.63","112","2022/03/22"
"","4410","","The Grapes of Wrath/The Moon is Down/Cannery Row/East of Eden/Of Mice & Men","John Steinbeck","1952","Classics","Fiction","Literature","4.27","1935","2022/03/22"
"","4411","","Eden in the East: The Drowned Continent of Southeast Asia","Stephen Oppenheimer","1998","History","Science","Nonfiction","4.02","129","2022/03/22"
"","4412","American Gods","American Gods","Neil Gaiman","","Fantasy","Fiction","Fantasy","4.11","834716","2022/03/22"
"","4413","","Separate But Equal: The Documentation of God in American History","Benjamin Weiss","","","","","0.0","0","2022/03/22"
"","4414","","East of Eden","Mary Gladwin","","","","","3.97","29","2022/03/22"
"","4415","","East Of Eden","John Steinbeck","1952","Classics","Fiction","Historical","4.39","470441","2022/03/22"
"","4416","","John F. Kennedy on Leadership: The Lessons and Legacy of a President","John A. Barnes","2005","Biography","Leadership","Business","3.87","102","2022/03/22"
"","4417","","Who Was John F. Kennedy?","Yona Zeldis McDonough","","Biography","Nonfiction","History","4.16","959","2022/03/22"
"","4418","","The Radical Right & the Murder of John F. Kennedy: Stunning Evidence in the Assassination of the President","Harrison Edward Livingstone","2004","","","","3.3","10","2022/03/22"
"","4419","","John Fitzgerald Kennedy: A Photography Montage","Phaidon Press","","History","Biography","","4.66","41","2022/03/22"
"","4420","","The Greatest Speeches Of President John F. Kennedy","John F. Kennedy","2000","History","Literature","American","4.58","36","2022/03/22"
"","4421","Library of American Biography","John F. Kennedy and a New Generation","David Burner","1988","History","","","2.86","28","2022/03/22"
"","4422","","A Confederacy of Dunces","John Kennedy Toole","1980","Fiction","Classics","Humor","3.88","251089","2022/03/22"
"","4423","","John F. Kennedy: A Biography","Michael O'Brien","","Biography","Politics","Presidents","3.98","216","2022/03/22"
"","4424","","An Unfinished Life: John F. Kennedy, 1917-1963","Robert Dallek","","Biography","History","Nonfiction","3.95","11782","2022/03/22"
"","4425","","New Every Morning: A Daily Devotional","James James Kennedy","","","","","2.0","1","2022/03/22"
"","4426","","The Real Meaning of the Zodiac","D. James Kennedy","","Nonfiction","Religion","Religion","3.8","46","2022/03/22"
"","4427","","What's Wrong with Same-Sex Marriage?","D. James Kennedy","2004","","","","2.73","15","2022/03/22"
"","4428","","Why the Ten Commandments Matter","D. James Kennedy","2005","","","","3.46","24","2022/03/22"
"","4429","","Evangelism Explosion","D. James Kennedy","1970","Christianity","Evangelism","Christian","3.51","125","2022/03/22"
"","4430","","The Books You Read","Charlie ""Tremendous"" Jones","1985","","","","3.71","7","2022/03/22"
"","4431","","What If the Bible Had Never Been Written?","D. James Kennedy","1998","Religion","Theology","History","3.81","36","2022/03/22"
"","4432","","D. James Kennedy: The Man and His Ministry","Herbert Lee Williams","","","","","3.33","3","2022/03/22"
"","4433","","Possible Side Effects","Augusten Burroughs","","Autobiography","Memoir","Nonfiction","3.98","46821","2022/03/22"
"","4434","","Sellevision","Augusten Burroughs","2000","Fiction","Humor","Contemporary","3.58","15401","2022/03/22"
"","4435","","Dry","Augusten Burroughs","2003","Autobiography","Memoir","Nonfiction","4.0","92884","2022/03/22"
"","4436","","Running with Scissors","Augusten Burroughs","2002","Autobiography","Memoir","Nonfiction","3.74","372800","2022/03/22"
"","4437","","Magical Thinking","Augusten Burroughs","","Nonfiction","Autobiography","Memoir","3.94","57114","2022/03/22"
"","4438","","Dry","Augusten Burroughs","","Autobiography","Memoir","Nonfiction","4.0","92884","2022/03/22"
"","4439","","Magical Thinking","Augusten Burroughs","2004","Nonfiction","Autobiography","Memoir","3.94","57114","2022/03/22"
"","4440","","Abnormal Psychology / Running with Scissors","Ronald J. Comer","","","","","4.12","25","2022/03/22"
"","4441","","Meditations From The Road: 365 Daily Lessons From The Road Less Travelled and The Different Drum","M. Scott Peck","1993","Spirituality","Self Help","Philosophy","3.78","101","2022/03/22"
"","4442","","The Road Less Traveled and Beyond: Spiritual Growth in an Age of Anxiety","M. Scott Peck","1986","Psychology","Self Help","Nonfiction","4.13","3661","2022/03/22"
"","4443","","The Different Drum: Community Making and Peace","M. Scott Peck","1987","Psychology","Nonfiction","Spirituality","3.92","1089","2022/03/22"
"","4444","","The Road Less Traveled: Part Three: Religion and Grace","M. Scott Peck","1986","Psychology","Self Help","Nonfiction","4.13","3661","2022/03/22"
"","4445","","Bankruptsociety Living in Fut","James V. McTevia","1992","","","","3.0","1","2022/03/22"
"","4446","","Glimpses of the Devil: A Psychiatrist's Personal Accounts of Possession, Exorcism, and Redemption","M. Scott Peck","2005","Nonfiction","Psychology","Religion","3.83","666","2022/03/22"
"","4447","","The Friendly Snowflake: A Fable of Faith, Love, and Family","M. Scott Peck","1992","Fiction","Childrens","Childrens","3.52","148","2022/03/22"
"","4448","","Golf and the Spirit: Lessons for the Journey","M. Scott Peck","1999","Religion","Nonfiction","Spirituality","3.5","161","2022/03/22"
"","4449","","Further Along the Road Less Traveled: ""Going to Omaha"": The Issue of Death and Meaning","M. Scott Peck","","","","","3.89","9","2022/03/22"
"","4450","","The Road Less Traveled: A New Psychology of Love, Traditional Values and Spiritual Growth","M. Scott Peck","","Psychology","Nonfiction","Self Help","4.06","91498","2022/03/22"
"","4451","","People of the Lie: The Hope for Healing Human Evil","M. Scott Peck","1983","Psychology","Nonfiction","Self Help","3.98","7653","2022/03/22"
"","4452","","The Road Less Traveled","M. Scott Peck","1978","Psychology","Nonfiction","Self Help","4.06","91498","2022/03/22"
"","4453","","In Search of Stones: A Pilgrimage of Faith, Reason, and Discovery","M. Scott Peck","1995","Nonfiction","Psychology","Spirituality","3.57","459","2022/03/22"
"","4454","","The Road Less Traveled: A New Psychology of Love, Traditional Values, and Spiritual Growth","M. Scott Peck","1978","Psychology","Nonfiction","Self Help","4.06","91498","2022/03/22"
"","4455","","Gifts for the Journey: Treasures of the Christian Life","M. Scott Peck","1995","","","","4.0","21","2022/03/22"
"","4456","","What Return Can I Make?: Dimensions of the Christian Experience","M. Scott Peck","","","","","3.96","28","2022/03/22"
"","4457","","Peck Gift Set Cst","M. Scott Peck","1991","","","","5.0","1","2022/03/22"
"","4458","","Denial of the Soul","M. Scott Peck","1991","Psychology","Nonfiction","Religion","3.75","163","2022/03/22"
"","4459","","The Less Traveled Road and the Bible","H. Wayne House","1995","","","","5.0","1","2022/03/22"
"","4460","","","","","","","","","","2022/03/22"
"","4461","","PEOPLE OF THE LIE VOL. 3 POSSESSION AND GROUP EVIL: Possession and Group Evil","M. Scott Peck","1983","Psychology","Nonfiction","Self Help","3.98","7653","2022/03/22"
"","4462","","Further Along the Road Less Traveled: Self-love Versus Self-esteem","M. Scott Peck","","","","","4.0","21","2022/03/22"
"","4463","","The Road Less Travelled And Beyond: Spiritual Growth in an Age of Anxiety","M. Scott Peck","1986","Psychology","Self Help","Nonfiction","4.13","3661","2022/03/22"
"","4464","","My Dear Watson: Being the Annals of Sherlock Holmes","David L. Hammer","1995","Mystery","","","3.5","4","2022/03/22"
"","4465","","The Adventures of Sherlock Holmes","Arthur Conan Doyle","1891","Classics","Mystery","Fiction","4.42","10026","2022/03/22"
"","4466","Sherlock Holmes","The Casebook of Sherlock Holmes","Arthur Conan Doyle","1927","Classics","Mystery","Fiction","4.15","24236","2022/03/22"
"","4467","","Collected Classics","Penguin Readers","","","","","4.17","6","2022/03/22"
"","4468","Sherlock Holmes","Study in Scarlet","Arthur Conan Doyle","1887","Classics","Mystery","Fiction","4.15","380536","2022/03/22"
"","4469","","","","","","","","","","2022/03/22"
"","4470","Sherlock Holmes","The Case Book of Sherlock Holmes","Arthur Conan Doyle","1927","Classics","Mystery","Fiction","4.15","24236","2022/03/22"
"","4471","Sherlock Holmes","Sherlock Holmes","Arthur Conan Doyle","1905","Classics","Mystery","Fiction","4.42","4870","2022/03/22"
"","4472","","A Prayer for Owen Meany","John Irving","1989","Fiction","Classics","Contemporary","4.24","300707","2022/03/22"
"","4473","","A Prayer for Owen Meany","John Irving","1989","Fiction","Classics","Contemporary","4.24","300707","2022/03/22"
"","4474","","A Prayer for Owen Meany","John Irving","1989","Fiction","Classics","Contemporary","4.24","300707","2022/03/22"
"","4475","","","","","","","","","","2022/03/22"
"","4476","","A Prayer For Owen Meany: Curriculum Unit","John Irving","1989","Fiction","Classics","Contemporary","4.24","300707","2022/03/22"
"","4477","","Complications: A Surgeon's Notes on an Imperfect Science","Atul Gawande","2002","Nonfiction","Health","Medicine","4.26","44323","2022/03/22"
"","4478","","Grand Complications: High Quality Watchmaking - Volume II","Tourbillon International","","","","","0.0","0","2022/03/22"
"","4479","","Sad Underwear and Other Complications: More Poems for Children and Their Parents","Judith Viorst","1995","Poetry","Childrens","Nonfiction","3.84","128","2022/03/22"
"","4480","","Complications in Regional Anesthesia and Pain Medicine","Joseph M. Neal","","","","","4.0","2","2022/03/22"
"","4481","","Complications in Surgery","Michael W. Mulholland","2005","","","","4.2","5","2022/03/22"
"","4482","","The Uncomplicated Guide to Diabetes Complications","American Diabetes Association","1998","","","","3.9","10","2022/03/22"
"","4483","","The Grand Complication","Allen Kurzweil","2001","Fiction","Mystery","Writing","3.23","759","2022/03/22"
"","4484","","Complications in Anesthesia","John L. Atlee","1998","","","","4.5","8","2022/03/22"
"","4485","Frank Lehmann","Herr Lehmann","Sven Regener","2001","Fiction","European Literature","German Literature","3.89","5350","2022/03/22"
"","4486","Bridget Jones","Bridget Jones's Diary","Helen Fielding","1996","Fiction","Womens Fiction","Chick Lit","3.79","924052","2022/03/22"
"","4487","Bridget Jones","Bridget Jones: The Edge Of Reason","Helen Fielding","","Womens Fiction","Chick Lit","Fiction","3.6","106601","2022/03/22"
"","4488","Bridget Jones","Bridget Jones's Guide to Life","Helen Fielding","2001","Womens Fiction","Chick Lit","Fiction","3.49","1189","2022/03/22"
"","4489","","Spring Cooking","Bridget Jones","2003","","","","0.0","0","2022/03/22"
"","4490","","A Cook's Year","Bridget Jones","2004","","","","0.0","0","2022/03/22"
"","4491","","The Complete Illustrated Book of Appetizers, Buffets, Finger Food & Party Food: How to Plan the Perfect Celebration with Over 400 Inspiring First Course, Nibbles, Finger Foods, Buffet and Party Dishes","Bridget Jones","","Food and Drink","Cookbooks","","4.0","6","2022/03/22"
"","4492","Bridget Jones","Le Journal de Bridget Jones","Helen Fielding","1996","Fiction","Womens Fiction","Chick Lit","3.79","924052","2022/03/22"
"","4493","","The Complete Guide To Microwave Cooking","Carol Bowen","1998","","","","0.0","0","2022/03/22"
"","4494","Bridget Jones","Bridget Jones: The Edge of Reason","Helen Fielding","1999","Womens Fiction","Chick Lit","Fiction","3.6","106601","2022/03/22"
