"","10379","","The Father and a Dream Play","August Strindberg","","Plays","","","3.17","18","2022/03/30"
"","10380","","My Father in Dreams","C.E. Poverman","1989","","","","4.0","1","2022/03/30"
"","10381","","Her Father's Dream, Her Obsession","Ronald Fils-Aime","","","","","0.0","0","2022/03/30"
"","10382","","Dreams from My Father: A Story of Race and Inheritance","Barack Obama","1995","Nonfiction","Biography","Autobiography","3.92","214506","2022/03/30"
"","10383","","Following My Father's Dreams: Journals From A Rookie Iditarod Run","James Warren","","","","","3.14","7","2022/03/30"
"","10384","","Embroidery Machine Essentials: How to Stabilize, Hoop and Stitch Decorative Designs","Jeanine Twigg","","Crafts","Sewing","Art","3.82","57","2022/03/30"
"","10385","","Designer Bead Embroidery: 150 Patterns and Complete Techniques","Kenneth D. King","","Crafts","Sewing","Art","3.74","39","2022/03/30"
"","10386","","Dictionary of Embroidery Stitches","Mary Thomas","1934","Reference","Art","Crafts","4.26","199","2022/03/30"
"","10387","","Bead Embroidery the Complete Guide: Bring New Dimension to Classic Needlework","Jane Davis","2005","Art","Crafts","Jewellery","3.85","27","2022/03/30"
"","10388","","Three-Dimensional Embroidery: Methods of Construction for the Third Dimension","Janet Edmonds","2006","Art","Crafts","","4.14","42","2022/03/30"
"","10389","","Kids' Embroidery: Projects for Kids of All Ages","Kristin Nicholas","","Art","Crafts","Nonfiction","3.91","32","2022/03/30"
"","10390","","Machine Embroidery Wild & Wacky: Stitch on Any and Every Surface","Linda Turner Griepentrog","","Art","Crafts","","3.92","12","2022/03/30"
"","10391","","18th Century Embroidery Techniques","Gail Marsh","","Couture","Fashion","Nonfiction","4.26","124","2022/03/30"
"","10392","","Embroidery Machine Essentials - Applique Adventures: Companion Project Series: Book 6","Mary Mulari","2004","Crafts","Sewing","","4.0","14","2022/03/30"
"","10393","","V for Vendetta","Steve Moore","1989","Fiction","Science Fiction","Science Fiction","4.15","3261","2022/03/30"
"","10394","","V for Vendetta","Steve Moore","1989","Fiction","Science Fiction","Science Fiction","4.15","3261","2022/03/30"
"","10395","","How Soccer Explains the World: An Unlikely Theory of Globalization","Franklin Foer","2004","Nonfiction","Sports","Sports","3.79","11988","2022/03/30"
"","10396","","","","","","","","","","2022/03/30"
"","10397","Everything Kids","The Everything Kids' Soccer Book: Rules, Techniques, and More About Your Favorite Sport!","Deborah W. Crisfield","","Nonfiction","Sports","Sports","3.79","71","2022/03/30"
"","10398","","","","","","","","","","2022/03/30"
"","10399","","Soccer","Hugh Hornby","1960","Sports","Sports","Nonfiction","4.33","156","2022/03/30"
"","10400","","Great Soccer Drills","Tom Fleck","2002","","","","3.81","32","2022/03/30"
"","10401","The Ultimate Guide to Weight Training for Sports","The Ultimate Guide To Weight Training For Soccer","Robert G. Price","2003","","","","3.69","16","2022/03/30"
"","10402","","Cat's Cradle","Kurt Vonnegut Jr.","1963","Fiction","Classics","Science Fiction","4.16","364328","2022/03/30"
"","10403","The New Doctor Who Adventures","Doctor Who: Cat's Cradle: Time's Crucible","Marc Platt","","Media Tie In","Doctor Who","Science Fiction","3.22","649","2022/03/30"
"","10404","The New Doctor Who Adventures","Doctor Who: Cat's Cradle-Witch Mark","Andrew  Hunt","","Media Tie In","Doctor Who","Fiction","3.2","447","2022/03/30"
"","10405","The New Doctor Who Adventures","Doctor Who: Cat's Cradle-Warhead","Andrew Cartmel","","Media Tie In","Doctor Who","Science Fiction","3.48","464","2022/03/30"
"","10406","","Cat's Cradle","Chieko N. Okazaki","1993","Nonfiction","Religion","Christianity","4.25","157","2022/03/30"
"","10407","","Cat's Cradle String Games","Camilla Gryski","1983","Nonfiction","Childrens","Sports and Games","3.84","76","2022/03/30"
"","10408","","Cat's Cradle Fun","Kate Mason","1996","","","","0.0","0","2022/03/30"
"","10409","","Cat's Cradle (Funpax)","D.K. Publishing","1998","","","","0.0","0","2022/03/30"
"","10410","","String Figures: Cat's Cradle, Jacob's Ladder, Two Stars, Magic Carpet, an Apache Door, Two Coyotes, Many Stars, and Many More","Joanmarie Kalter","","","","","0.0","0","2022/03/30"
"","10411","","Cat's Cradle","Leslie Sands","","","","","3.5","2","2022/03/30"
"","10412","","He's Just Not That Into You: The No-Excuses Truth to Understanding Guys","Greg Behrendt","2004","Nonfiction","Self Help","Womens Fiction","3.66","64324","2022/03/30"
"","10413","Ripley's Believe It or Not","Ripley's Believe it or Not Special Edition 2007","Ripley Entertainment Inc.","","Nonfiction","","","4.12","60","2022/03/30"
"","10414","","Do Not Open This Book","Michaela Muntean","2006","Childrens","Picture Books","Childrens","3.92","664","2022/03/30"
"","10415","","Bud, Not Buddy","Christopher Paul Curtis","1999","Historical","Historical Fiction","Young Adult","3.95","104233","2022/03/30"
"","10416","","Not Your Mother's Slow Cooker Cookbook","Beth Hensperger","2004","Food and Drink","Cookbooks","Food and Drink","3.79","5813","2022/03/30"
"","10417","Best Behavior","Hands Are Not for Hitting","Martine Agassi","2000","Childrens","Picture Books","Childrens","4.04","544","2022/03/30"
"","10418","","He's Just Not That Into You: Your Daily Wake-Up Call","Greg Behrendt","","Nonfiction","Self Help","Womens Fiction","3.75","851","2022/03/30"
"","10419","","Not Enough Indians","Harry Shearer","","Humor","Fiction","","2.85","183","2022/03/30"
"","10420","","Not So Big House","Sarah Susanka","1998","Nonfiction","Architecture","Design","4.06","1939","2022/03/30"
"","10421","","Rodinsky's Room","Rachel Lichtenstein","1999","Nonfiction","Biography","History","3.88","253","2022/03/30"
"","10422","","Married to Genius: A Fascinating Insight Into the Married Lives of Nine Modern Writers","Jeffrey Meyers","","Biography","Nonfiction","Literature","3.72","36","2022/03/30"
"","10423","Lonely Planet","Cuba","Brendan Sainsbury","1997","Travel","Nonfiction","Reference","3.96","695","2022/03/30"
"","10424","","Inside Cuba","Julio César Pérez Hernández","","","","","4.4","15","2022/03/30"
"","10425","Moon Handbooks","Cuba","Christopher P. Baker","1997","Travel","Reference","","3.96","51","2022/03/30"
"","10426","","A Taste of Old Cuba: More Than 150 Recipes for Delicious, Authentic, and Traditional Dishes","Maria Josefa Lluria de O'Higgins","","Food and Drink","Cookbooks","Food and Drink","4.29","59","2022/03/30"
"","10427","","The Rough Guide to Cuba 3","Fiona McAuslan","2000","Travel","","","3.76","42","2022/03/30"
"","10428","Lonely Planet","Cuba","Lonely Planet","1997","Travel","Nonfiction","Reference","3.96","695","2022/03/30"
"","10429","","Cuba: A New History","Richard Gott","2004","History","Nonfiction","Politics","4.07","413","2022/03/30"
"","10430","","Cuba Diaries: An American Housewife in Havana","Isadora Tattlin","2002","Travel","Nonfiction","Autobiography","3.52","960","2022/03/30"
"","10431","","Cuba 15","Nancy Osa","2003","Young Adult","Realistic Fiction","Fiction","3.45","1165","2022/03/30"
"","10432","","This Is Cuba: An Outlaw Culture Survives","Ben Corbett","2002","Nonfiction","Travel","Politics","3.72","158","2022/03/30"
"","10433","Jake Grafton","Cuba","Stephen Coonts","1999","Fiction","War","Military Fiction","3.84","1913","2022/03/30"
"","10434","","Es Cuba: Life and Love on an Illegal Island","Lea Aschkenas","","Travel","Nonfiction","Autobiography","3.95","173","2022/03/30"
"","10435","","Cuba: 400 Years of Architectural Heritage","Rachel Carley","1997","","","","4.62","13","2022/03/30"
"","10436","","Dancing With Cuba","Alma Guillermoprieto","2004","Autobiography","Memoir","Nonfiction","3.49","359","2022/03/30"
"","10437","","Cuba Confidential: Love and Vengeance in Miami and Havana","Ann Louise Bardach","2002","History","Nonfiction","Politics","3.8","227","2022/03/30"
"","10438","","Field Guide to Birds of Cuba","Orlando H. Garrido","2000","Reference","Nonfiction","Animals","4.31","16","2022/03/30"
"","10439","","The Houses of Old Cuba","Llilian Llanes","1999","","","","3.91","11","2022/03/30"
"","10440","","Cuba Style: Graphics from the Golden Age of Design","Steven Heller","","","","","4.0","15","2022/03/30"
"","10441","","The Memory Keeper's Daughter","Kim Edwards","2005","Fiction","Contemporary","Adult Fiction","3.69","582049","2022/03/30"
"","10442","","The Memory Keeper's Daughter","Kim Edwards","2005","Fiction","Contemporary","Adult Fiction","3.69","582049","2022/03/30"
"","10443","","The Memory Keeper's Daughter","Kim Edwards","2005","Fiction","Contemporary","Adult Fiction","3.69","582049","2022/03/30"
"","10444","Shoes","Ballet Shoes","Noel Streatfeild","1936","Classics","Childrens","Fiction","4.06","35084","2022/03/30"
"","10445","","Too Far to Go: The Maples Stories","John Updike","1980","Short Stories","Fiction","Literature","4.0","1438","2022/03/30"
"","10446","","Thursday's Child Has Far To Go: A Memoir of the Journeying Years","Walter Laqueur","1993","Autobiography","Memoir","","3.6","5","2022/03/30"
"","10447","",". . .Has Far to Go.","Bob Moore","2001","","","","5.0","1","2022/03/30"
"","10448","","So Far So Good.","Rhodri Jones","","","","","0.0","0","2022/03/30"
"","10449","","Famine in Far-Go (Gamma World module GW2)","Michael Price","1982","Science Fiction","","","3.54","13","2022/03/30"
"","10450","","Noel Streatfeild: A Biography","Angela Bull","","Biography","Biography Memoir","Writing","3.93","28","2022/03/30"
"","10451","Bell Family","New Shoes","Noel Streatfeild","1960","Childrens","Fiction","Historical","3.84","189","2022/03/30"
"","10452","","Noel Streatfeild","Nancy Huse","","","","","3.0","7","2022/03/30"
"","10453","Shoes","Skating Shoes","Noel Streatfeild","1951","Childrens","Fiction","Classics","4.1","3528","2022/03/30"
"","10454","Gemma","Gemma in Love","Noel Streatfeild","1969","Childrens","Fiction","Young Adult","3.77","195","2022/03/30"
"","10455","","Caldicott Place","Noel Streatfeild","","Childrens","Fiction","Classics","3.85","188","2022/03/30"
"","10456","Margaret Thursday","Far to Go","Noel Streatfeild","1976","Childrens","Fiction","Childrens","3.74","269","2022/03/30"
"","10457","Shoes","Apple Bough","Noel Streatfeild","1962","Childrens","Fiction","Childrens","4.0","615","2022/03/30"
"","10458","","Gran-Nannie","Noel Streatfeild","1976","Nonfiction","History","Biography","3.96","235","2022/03/30"
"","10459","","When the Sirens Wailed","Noel Streatfeild","1974","Historical","Historical Fiction","Childrens","3.77","294","2022/03/30"
"","10460","","The Children on the Top Floor","Noel Streatfeild","1965","Childrens","Fiction","European Literature","3.82","173","2022/03/30"
"","10461","Duluoz Legend","Desolation Angels","Jack Kerouac","1958","Fiction","Classics","Literature","3.93","10865","2022/03/30"
"","10462","","Door Wide Open: A Beat Love Affair in Letters, 1957-1958","Jack Kerouac","2000","Nonfiction","Biography","Autobiography","3.83","743","2022/03/30"
"","10463","","Lessons of the Lotus: Practical Spiritual Teachings of a Traveling Buddhist Monk","Bhante Y. Wimala","1997","Religion","Buddhism","Spirituality","4.21","80","2022/03/30"
"","10464","","Healing With Whole Foods: Asian Traditions and Modern Nutrition","Paul Pitchford","1993","Health","Health","Nutrition","4.41","3167","2022/03/30"
"","10465","","The Healing Power of Whole Foods","Beth Loiselle","","","","","3.63","8","2022/03/30"
"","10466","","The Whole Foods Market Cookbook: A Guide to Natural Foods with 350 Recipes","Steven Petusevsky","","Food and Drink","Cookbooks","Food and Drink","3.88","378","2022/03/30"
"","10467","","The Self-Healing Cookbook:  Whole Foods To Balance Body, Mind and Moods","Kristina Turner","1988","Food and Drink","Cookbooks","Health","4.04","261","2022/03/30"
"","10468","","The Practical Encyclopedia of Whole Foods: With Recipes for Health and Healing","Nicola Graimes","","Food and Drink","Cookbooks","","3.92","12","2022/03/30"
"","10469","","Cook's Guide to Healthy Wholefoods: An Illustrated Guide to the Essential Ingredients for Good Health","Nicola Graimes","2000","","","","4.0","4","2022/03/30"
"","10470","","The Practical Encyclopedia of Whole Foods: With Recipes for Health and Healing","Nicola Graimes","1999","Food and Drink","Cookbooks","","3.92","12","2022/03/30"
"","10471","","The New Whole Foods Encyclopedia: A Comprehensive Resource for Healthy Eating","Rebecca Wood","","Food and Drink","Food","Food and Drink","4.18","294","2022/03/30"
"","10472","","Namesake","Michel Goldberg","","","","","3.83","6","2022/03/30"
"","10473","","","","","","","","","","2022/03/30"
"","10474","","The Discomfort Zone: A Personal Journey","Jonathan Franzen","2006","Nonfiction","Autobiography","Memoir","3.41","5986","2022/03/30"
"","10475","","","","","","","","","","2022/03/30"
"","10476","","The Parrot's Lament, and Other True Tales of Animal Intrigue, Intelligence, and Ingenuity","Eugene Linden","1999","Nonfiction","Animals","Science","3.92","442","2022/03/30"
"","10477","","Vilanova Artigas","Marcelo Carvalho Ferraz","","","","","3.5","2","2022/03/30"
"","10478","","The Architecture Of Walter Burley Griffin","Donald Leslie Johnson","","","","","3.33","3","2022/03/30"
"","10479","","Italian Art: Painting, Sculpture, Architecture From The Origins To The Present Day","Mattia Reiche","2000","","","","4.5","2","2022/03/30"
"","10480","","Schindler's List","Thomas Keneally","1982","History","Nonfiction","Classics","4.33","154099","2022/03/30"
"","10481","","Three Pieces from Schindler's List Violin and Piano","Itzhak Perlman","","","","","4.56","9","2022/03/30"
"","10482","","I Will Plant You a Lilac Tree: A Memoir of a Schindler's List Survivor","Laura Hillman","2003","World War II","Holocaust","Nonfiction","4.13","5083","2022/03/30"
"","10483","","Schindler's List","Thomas Keneally","1982","History","Nonfiction","Classics","4.33","154099","2022/03/30"
"","10484","","Schindler's List (Unabridged)","Thomas Keneally","1982","History","Nonfiction","Classics","4.33","154099","2022/03/30"
"","10485","","Schindler's List","Thomas Keneally","1982","History","Nonfiction","Classics","4.33","154099","2022/03/30"
"","10486","","","","","","","","","","2022/03/30"
"","10487","","The Key to The Name of the Rose: Including Translations of All Non-English Passages","Adele J. Haft","1987","Nonfiction","Reference","Criticism","3.82","298","2022/03/30"
"","10488","","El nombre de la rosa","Umberto Eco","1980","Fiction","Historical","Historical Fiction","4.13","329848","2022/03/30"
"","10489","","The Name of the Rose","Umberto Eco","1980","Fiction","Historical","Historical Fiction","4.13","329848","2022/03/30"
"","10490","","Postscript to the Name of the Rose","Umberto Eco","1983","Nonfiction","Literature","Writing","4.04","1482","2022/03/30"
"","10491","","El nombre de la Rosa","Umberto Eco","1980","Fiction","Historical","Historical Fiction","4.13","329848","2022/03/30"
"","10492","","Имя розы","Umberto Eco","1980","Fiction","Historical","Historical Fiction","4.13","329848","2022/03/30"
"","10493","","My Name Is Rose","Theodora Keogh","1956","","","","3.5","6","2022/03/30"
"","10494","","My Name Is Rose","Rose Doinron","","","","","0.0","0","2022/03/30"
"","10495","","El nombre de la rosa","Umberto Eco","1980","Fiction","Historical","Historical Fiction","4.13","329848","2022/03/30"
"","10496","","Naming the Rose: Essays on Eco's the Name of the Rose","M. Thomas Inge","1988","","","","4.22","9","2022/03/30"
"","10497","","How To Pronounce French Rose Names","Diana Bellucci","","","","","0.0","0","2022/03/30"
"","10498","","A Rose By Any Other Name","Rose Hancock","","","","","5.0","1","2022/03/30"
"","10499","","A Rose by Another Name: A Survey of Literary Flora from Shakespeare to Eco","Robert F. Fleissner","","","","","0.0","0","2022/03/30"
"","10500","","Baby Names for Dummies","Margaret Rose","2005","Nonfiction","Parenting","","3.36","28","2022/03/30"
"","10501","Greyhawk Adventures","The Name of the Game","Rose Estes","","Fantasy","Fiction","Games","3.23","138","2022/03/30"
"","10502","","A Rose By Another Name","E. Cambridge","","","","","0.0","0","2022/03/30"
"","10503","","The Mysterious Flame of Queen Loana","Umberto Eco","2004","Fiction","Historical","Historical Fiction","3.37","11406","2022/03/30"
"","10504","","Foucault's Pendulum","Umberto Eco","1988","Fiction","Mystery","Historical","3.9","64655","2022/03/31"
"","10505","","History of Beauty","Umberto Eco","2004","Art","Nonfiction","History","3.82","56430","2022/03/31"
"","10506","","The Island of the Day Before","Umberto Eco","1994","Fiction","Historical","Historical Fiction","3.48","14528","2022/03/31"
"","10507","","Baudolino","Umberto Eco","2000","Fiction","Historical","Historical Fiction","3.77","21443","2022/03/31"
"","10508","","On Literature","Umberto Eco","2002","Nonfiction","Writing","Essays","3.96","2104","2022/03/31"
"","10509","","The ECO Guide to Careers that Make a Difference: Environmental Work For A Sustainable World","Environmental Careers Organization","","","","","3.58","12","2022/03/31"
"","10510","","Eco Economy","Lester R. Brown","2001","Nonfiction","Economics","Environment","3.73","126","2022/03/31"
"","10511","","Belief or Nonbelief?","Umberto Eco","1996","Philosophy","Religion","Nonfiction","3.68","1554","2022/03/31"
"","10512","","Serendipities","Umberto Eco","1998","Nonfiction","Philosophy","Humanities","3.82","1331","2022/03/31"
"","10513","","The Search for the Perfect Language","Umberto Eco","1993","Nonfiction","History","Humanities","3.95","724","2022/03/31"
"","10514","","Travels in Hyperreality","Umberto Eco","1973","Nonfiction","Philosophy","Writing","3.9","2606","2022/03/31"
"","10515","","Five Moral Pieces","Umberto Eco","1997","Nonfiction","Philosophy","Writing","3.82","1359","2022/03/31"
"","10516","Tanner Lectures in Human Values","Interpretation and Overinterpretation","Umberto Eco","1992","Philosophy","Nonfiction","Literature","3.93","535","2022/03/31"
"","10517","Diario minimo","How to Travel with a Salmon and Other Essays","Umberto Eco","1992","Writing","Essays","Nonfiction","3.84","5530","2022/03/31"
"","10518","Advances in Semiotics","A Theory of Semiotics","Umberto Eco","","Philosophy","Nonfiction","Linguistics","4.03","1251","2022/03/31"
"","10519","","Art and Beauty in the Middle Ages","Umberto Eco","1987","Art","History","Nonfiction","3.98","1302","2022/03/31"
"","10520","","La misteriosa llama de la reina Loana","Umberto Eco","2004","Fiction","Historical","Historical Fiction","3.37","11406","2022/03/31"
"","10521","Diario minimo","Misreadings","Umberto Eco","1963","Nonfiction","Writing","Essays","3.84","1607","2022/03/31"
"","10522","","Il nome della rosa","Umberto Eco","1980","Fiction","Historical","Historical Fiction","4.13","329828","2022/03/31"
"","10523","","Historia de la belleza","Umberto Eco","2004","Art","Nonfiction","History","3.82","56430","2022/03/31"
"","10524","","Apocalypse Postponed","Umberto Eco","1964","Nonfiction","Philosophy","Writing","3.97","871","2022/03/31"
"","10525","","Mouse or Rat?: Translation as Negotiation","Umberto Eco","2003","Nonfiction","Humanities","Linguistics","3.82","393","2022/03/31"
"","10526","","Umberto Eco and the Open Text: Semiotics, Fiction, Popular Culture","Peter Bondanella","1997","","","","3.83","12","2022/03/31"
"","10527","","Faith in Fakes: Travels in Hyperreality","Umberto Eco","1973","Nonfiction","Philosophy","Writing","3.9","2606","2022/03/31"
"","10528","Advances in Semiotics","The Role of the Reader: Explorations in the Semiotics of Texts","Umberto Eco","1979","Philosophy","Nonfiction","Linguistics","4.08","254","2022/03/31"
"","10529","","Libraries","Candida Höfer","2005","Nonfiction","Writing","Books About Books","4.21","392","2022/03/31"
"","10530","The Charles Eliot Norton Lectures","Six Walks in the Fictional Woods","Umberto Eco","1994","Nonfiction","Writing","Essays","4.15","2631","2022/03/31"
"","10531","","L'isola del giorno prima","Umberto Eco","1994","Fiction","Historical","Historical Fiction","3.48","14528","2022/03/31"
"","10532","","The Art of War","Sun Tzu","-500","Classics","Nonfiction","Philosophy","3.97","396430","2022/03/31"
"","10533","","The Art of War","Sun Tzu","-500","Classics","Nonfiction","Philosophy","3.97","396430","2022/03/31"
"","10534","","The Art of War","Sun Tzu","-500","Classics","Nonfiction","Philosophy","3.97","396430","2022/03/31"
"","10535","","The Complete Art Of War: Sun Tzu/sun Pin","Sun Tzu","","Classics","Nonfiction","Philosophy","4.25","2746","2022/03/31"
"","10536","","Sun Tzu: The Art of War for Managers; 50 Strategic Rules","Sun Tzu","","Business","Business","Management","3.83","523","2022/03/31"
"","10537","","The Art of War","Sun Tzu","-500","Classics","Nonfiction","Philosophy","3.97","396430","2022/03/31"
"","10538","","The Life and Times of the Thunderbolt Kid","Bill Bryson","2006","Nonfiction","Autobiography","Memoir","3.91","63418","2022/03/31"
"","10539","","The Lost Continent:  Travels in Small-town America","Bill Bryson","1989","Travel","Nonfiction","Humor","3.81","57511","2022/03/31"
"","10540","Notes from a Small Island","Notes From A Small Island","Bill Bryson","1995","Travel","Nonfiction","Humor","3.91","104552","2022/03/31"
"","10541","","Made in America: An Informal History of the English Language in the United States","Bill Bryson","1994","Nonfiction","History","Humanities","3.91","14075","2022/03/31"
"","10542","","Ulysses","James Joyce","1922","Classics","Fiction","Literature","3.74","117534","2022/03/31"
"","10543","","Ulysses Annotated","Don Gifford","1974","Reference","Nonfiction","Classics","4.2","2996","2022/03/31"
"","10544","The Papers of Ulysses S. Grant","Personal Memoirs of Ulysses S. Grant Part Two","Ulysses S. Grant","1969","History","Biography","Nonfiction","4.25","626","2022/03/31"
"","10545","","Ulysses","James Joyce","1922","Classics","Fiction","Literature","3.74","117534","2022/03/31"
"","10546","Ulysses Moore","The Long-Lost Map","Pierdomenico Baccalario","2005","Fantasy","Adventure","Childrens","4.03","3440","2022/03/31"
"","10547","","Memoirs and Selected Letters","Ulysses S. Grant","1972","History","Biography","Military History","4.02","3520","2022/03/31"
"","10548","","Adventures of Ulysses","Bernard Evslin","1969","Fantasy","Mythology","Classics","3.48","1947","2022/03/31"
"","10549","The Papers of Ulysses S. Grant","Personal Memoirs, Vol. 1","Ulysses S. Grant","1885","History","Biography","Nonfiction","4.13","771","2022/03/31"
"","10550","The Papers of Ulysses S. Grant","Personal Memoirs, Vol. 2","Ulysses S. Grant","1969","History","Biography","Nonfiction","4.25","626","2022/03/31"
"","10551","","The Christmas Books of Charles Dickens: A Christmas Carol,  Christmas Festivities, The Story of the Goblins Who Stole a Sexton, A Christmas Tree, The Seven Poor Travellers, The Haunted Man + A Christmas episode from Master Humphrey's Clock","Charles Dickens","1843","Classics","Fiction","Holiday","4.14","35851","2022/03/31"
"","10552","","The Wicked Wit of Charles Dickens","Shelley Klein","","Nonfiction","Humor","","3.46","69","2022/03/31"
"","10553","","Stories for Christmas","Charles Dickens","1862","Classics","Holiday","Christmas","4.19","528","2022/03/31"
"","10554","","A Christmas Carol and Other Stories","Charles Dickens","","Classics","Fiction","Short Stories","4.16","360","2022/03/31"
"","10555","","A Christmas Carol","Charles Dickens","1843","Classics","Fiction","Holiday","4.07","707815","2022/03/31"
"","10556","","A Christmas Carol","Charles Dickens","1843","Classics","Fiction","Holiday","4.07","707815","2022/03/31"
"","10557","","Christmas Books: A Christmas Carol, The Chimes, The Cricket on the Hearth, The Battle of Life, The Haunted Man","Charles Dickens","1848","Classics","Fiction","Holiday","3.94","1502","2022/03/31"
"","10558","The d'Artagnan Romances","The Three Musketeers","Alexandre Dumas","1844","Classics","Fiction","Historical","4.08","295345","2022/03/31"
"","10559","The d'Artagnan Romances","The Three Musketeers","Alexandre Dumas","1844","Classics","Fiction","Historical","4.08","295345","2022/03/31"
"","10560","The d'Artagnan Romances","The Three Musketeers","Alexandre Dumas","1844","Classics","Fiction","Historical","4.08","295345","2022/03/31"
"","10561","The d'Artagnan Romances","The Three Musketeers","Alexandre Dumas","1844","Classics","Fiction","Historical","4.08","295345","2022/03/31"
"","10562","","The Three Musketeers (Great Illustrated Classics)","Malvina G. Vogel","1977","Classics","Fiction","Historical","4.07","1784","2022/03/31"
"","10563","The d'Artagnan Romances","The Three Musketeers","Alexandre Dumas","1844","Classics","Fiction","Historical","4.08","295345","2022/03/31"
"","10564","Les Trois Mousquetaires","The Three Musketeers, Vol. I","Alexandre Dumas","1844","Classics","Cultural","France","4.22","2669","2022/03/31"
"","10565","The d'Artagnan Romances","The Three Musketeers","Alexandre Dumas","1844","Classics","Fiction","Historical","4.08","295345","2022/03/31"
"","10566","","Lisey's Story","Stephen King","","Horror","Fiction","Fantasy","3.69","77005","2022/03/31"
"","10567","","Cell","Stephen King","2006","Horror","Fiction","Horror","3.66","207288","2022/03/31"
"","10568","","King Arthur Flour Whole Grain Baking: Delicious Recipes Using Nutritious Whole Grains","King Arthur Flour","","Food and Drink","Cookbooks","Food and Drink","4.13","5083","2022/03/31"
"","10569","","On Writing: A Memoir of the Craft","Stephen King","2000","Nonfiction","Language","Writing","4.32","252784","2022/03/31"
"","10570","King Dork","King Dork","Frank Portman","","Young Adult","Fiction","Humor","3.55","7038","2022/03/31"
